Title,Body,Link,Date,Type,Combined_Text,PText,PTitle
search algorithm reveals nearly 200 kinds crispr systems,microbial sequence databases contain wealth information enzymes molecules could adapted biotechnology databases grown large recent years theyve become difficult search efficiently enzymes interest scientists mcgovern institute brain research mit broad institute mit harvard national center biotechnology information ncbi national institutes health developed search algorithm identified 188 kinds rare crispr systems bacterial genomes encompassing thousands individual systems work appears today algorithm com,https://news.mit.edu/2023/search-algorithm-reveals-nearly-200-new-kinds-crispr-systems-1123,"Thu, 23 Nov 2023 14:00:00 -0500",science,search algorithm reveals nearly 200 kinds crispr systems microbial sequence databases contain wealth information enzymes molecules could adapted biotechnology databases grown large recent years theyve become difficult search efficiently enzymes interest scientists mcgovern institute brain research mit broad institute mit harvard national center biotechnology information ncbi national institutes health developed search algorithm identified 188 kinds rare crispr systems bacterial genomes encompassing thousands individual systems work appears today algorithm com,"['search', 'algorithm', 'reveals', 'nearly', '200', 'kinds', 'crispr', 'systems', 'microbial', 'sequence', 'databases', 'contain', 'wealth', 'information', 'enzymes', 'molecules', 'could', 'adapted', 'biotechnology', 'databases', 'grown', 'large', 'recent', 'years', 'theyve', 'become', 'difficult', 'search', 'efficiently', 'enzymes', 'interest', 'scientists', 'mcgovern', 'institute', 'brain', 'research', 'mit', 'broad', 'institute', 'mit', 'harvard', 'national', 'center', 'biotechnology', 'information', 'ncbi', 'national', 'institutes', 'health', 'developed', 'search', 'algorithm', 'identified', '188', 'kinds', 'rare', 'crispr', 'systems', 'bacterial', 'genomes', 'encompassing', 'thousands', 'individual', 'systems', 'work', 'appears', 'today', 'algorithm', 'com']","['search', 'algorithm', 'reveals', 'nearly', '200', 'kinds', 'crispr', 'systems']"
students pitch transformative ideas generative ai mit ignite competition,semester students postdocs across mit invited submit ideas firstever mit ignite generative ai entrepreneurship competition 100 teams submitted proposals startups utilize generative artificial intelligence technologies develop solutions across diverse range disciplines including human health climate change education workforce dynamics oct 30 12 finalists pitched ideas front panel expert judges packed room samberg conference center mit responsibility help shape future ai innovation broadly beneficialnbsp need lot great ideas turned pretty reliable source great,https://news.mit.edu/2023/students-pitch-transformative-ideas-generative-ai-mit-ignite-competition-1121,"Tue, 21 Nov 2023 11:50:00 -0500",science,students pitch transformative ideas generative ai mit ignite competition semester students postdocs across mit invited submit ideas firstever mit ignite generative ai entrepreneurship competition 100 teams submitted proposals startups utilize generative artificial intelligence technologies develop solutions across diverse range disciplines including human health climate change education workforce dynamics oct 30 12 finalists pitched ideas front panel expert judges packed room samberg conference center mit responsibility help shape future ai innovation broadly beneficialnbsp need lot great ideas turned pretty reliable source great,"['students', 'pitch', 'transformative', 'ideas', 'generative', 'ai', 'mit', 'ignite', 'competition', 'semester', 'students', 'postdocs', 'across', 'mit', 'invited', 'submit', 'ideas', 'firstever', 'mit', 'ignite', 'generative', 'ai', 'entrepreneurship', 'competition', '100', 'teams', 'submitted', 'proposals', 'startups', 'utilize', 'generative', 'artificial', 'intelligence', 'technologies', 'develop', 'solutions', 'across', 'diverse', 'range', 'disciplines', 'including', 'human', 'health', 'climate', 'change', 'education', 'workforce', 'dynamics', 'oct', '30', '12', 'finalists', 'pitched', 'ideas', 'front', 'panel', 'expert', 'judges', 'packed', 'room', 'samberg', 'conference', 'center', 'mit', 'responsibility', 'help', 'shape', 'future', 'ai', 'innovation', 'broadly', 'beneficialnbsp', 'need', 'lot', 'great', 'ideas', 'turned', 'pretty', 'reliable', 'source', 'great']","['students', 'pitch', 'transformative', 'ideas', 'generative', 'ai', 'mit', 'ignite', 'competition']"
synthetic imagery sets bar ai training efficiency,data soil fertile ground mit researchers planting pixels using synthetic images train machine learning models team scientists recently surpassed results obtained traditional realimage training methodsnbsp core approach system called stablerep doesnt use synthetic images generates ultrapopular texttoimage models like stable diffusion like creating worlds wordsnbsp whats stablereps secret sauce strategy called multipositive contrastive learning teaching model learn highlevel concepts context variance f,https://news.mit.edu/2023/synthetic-imagery-sets-new-bar-ai-training-efficiency-1120,"Mon, 20 Nov 2023 09:00:00 -0500",science,synthetic imagery sets bar ai training efficiency data soil fertile ground mit researchers planting pixels using synthetic images train machine learning models team scientists recently surpassed results obtained traditional realimage training methodsnbsp core approach system called stablerep doesnt use synthetic images generates ultrapopular texttoimage models like stable diffusion like creating worlds wordsnbsp whats stablereps secret sauce strategy called multipositive contrastive learning teaching model learn highlevel concepts context variance f,"['synthetic', 'imagery', 'sets', 'bar', 'ai', 'training', 'efficiency', 'data', 'soil', 'fertile', 'ground', 'mit', 'researchers', 'planting', 'pixels', 'using', 'synthetic', 'images', 'train', 'machine', 'learning', 'models', 'team', 'scientists', 'recently', 'surpassed', 'results', 'obtained', 'traditional', 'realimage', 'training', 'methodsnbsp', 'core', 'approach', 'system', 'called', 'stablerep', 'doesnt', 'use', 'synthetic', 'images', 'generates', 'ultrapopular', 'texttoimage', 'models', 'like', 'stable', 'diffusion', 'like', 'creating', 'worlds', 'wordsnbsp', 'whats', 'stablereps', 'secret', 'sauce', 'strategy', 'called', 'multipositive', 'contrastive', 'learning', 'teaching', 'model', 'learn', 'highlevel', 'concepts', 'context', 'variance', 'f']","['synthetic', 'imagery', 'sets', 'bar', 'ai', 'training', 'efficiency']"
technique enables ai edge devices keep learning time,personalized deeplearning models enable artificial intelligence chatbots adapt understand users accent smart keyboards continuously update better predict next word based someones typing history customization requires constant finetuning machinelearning model data smartphones edge devices lack memory computational power necessary finetuning process user data typically uploaded cloud servers model updated data transmission uses great deal energy sending sensitive user data cloud server poses security risknbspnbsp researchers mit mitibm watson ai lab elsewhere developed technique enables deeplearning models,https://news.mit.edu/2023/technique-enables-ai-edge-devices-keep-learning-over-time,"Thu, 16 Nov 2023 00:00:00 -0500",science,technique enables ai edge devices keep learning time personalized deeplearning models enable artificial intelligence chatbots adapt understand users accent smart keyboards continuously update better predict next word based someones typing history customization requires constant finetuning machinelearning model data smartphones edge devices lack memory computational power necessary finetuning process user data typically uploaded cloud servers model updated data transmission uses great deal energy sending sensitive user data cloud server poses security risknbspnbsp researchers mit mitibm watson ai lab elsewhere developed technique enables deeplearning models,"['technique', 'enables', 'ai', 'edge', 'devices', 'keep', 'learning', 'time', 'personalized', 'deeplearning', 'models', 'enable', 'artificial', 'intelligence', 'chatbots', 'adapt', 'understand', 'users', 'accent', 'smart', 'keyboards', 'continuously', 'update', 'better', 'predict', 'next', 'word', 'based', 'someones', 'typing', 'history', 'customization', 'requires', 'constant', 'finetuning', 'machinelearning', 'model', 'data', 'smartphones', 'edge', 'devices', 'lack', 'memory', 'computational', 'power', 'necessary', 'finetuning', 'process', 'user', 'data', 'typically', 'uploaded', 'cloud', 'servers', 'model', 'updated', 'data', 'transmission', 'uses', 'great', 'deal', 'energy', 'sending', 'sensitive', 'user', 'data', 'cloud', 'server', 'poses', 'security', 'risknbspnbsp', 'researchers', 'mit', 'mitibm', 'watson', 'ai', 'lab', 'elsewhere', 'developed', 'technique', 'enables', 'deeplearning', 'models']","['technique', 'enables', 'ai', 'edge', 'devices', 'keep', 'learning', 'time']"
writing code decoding world,several years ago mit anthropologist hctor beltrn 07 attended event mexico billed first allwomens hackathon latin america programmers women time came hackathon pitches large number family members arrived watch grandmothers mothers showed cheer hackathon participants beltrn says thats something never seen us inspiring felt good see people usually excluded spaces welcomed part infrastructure innovation sense grandmothers hacked hackathon hackathons started maledominated codewriting marathons often inaccessible women even join tech,https://news.mit.edu/2023/writing-code-and-decoding-world-1114,"Tue, 14 Nov 2023 00:00:00 -0500",science,writing code decoding world several years ago mit anthropologist hctor beltrn 07 attended event mexico billed first allwomens hackathon latin america programmers women time came hackathon pitches large number family members arrived watch grandmothers mothers showed cheer hackathon participants beltrn says thats something never seen us inspiring felt good see people usually excluded spaces welcomed part infrastructure innovation sense grandmothers hacked hackathon hackathons started maledominated codewriting marathons often inaccessible women even join tech,"['writing', 'code', 'decoding', 'world', 'several', 'years', 'ago', 'mit', 'anthropologist', 'hctor', 'beltrn', '07', 'attended', 'event', 'mexico', 'billed', 'first', 'allwomens', 'hackathon', 'latin', 'america', 'programmers', 'women', 'time', 'came', 'hackathon', 'pitches', 'large', 'number', 'family', 'members', 'arrived', 'watch', 'grandmothers', 'mothers', 'showed', 'cheer', 'hackathon', 'participants', 'beltrn', 'says', 'thats', 'something', 'never', 'seen', 'us', 'inspiring', 'felt', 'good', 'see', 'people', 'usually', 'excluded', 'spaces', 'welcomed', 'part', 'infrastructure', 'innovation', 'sense', 'grandmothers', 'hacked', 'hackathon', 'hackathons', 'started', 'maledominated', 'codewriting', 'marathons', 'often', 'inaccessible', 'women', 'even', 'join', 'tech']","['writing', 'code', 'decoding', 'world']"
explained generative ai,quick scan headlines makes seem like generative artificial intelligence everywhere days fact headlines may actually written generative ai like openais chatgpt chatbot demonstrated uncanny ability produce text seems written human people really mean say generative ai generative ai boom past years people talked ai typically talking machinelearning models learn make prediction based data instance models trained using millions examples predict whether certain xray shows signs tumor particular borrower likely default loan generativ,https://news.mit.edu/2023/explained-generative-ai-1109,"Thu, 09 Nov 2023 00:00:00 -0500",science,explained generative ai quick scan headlines makes seem like generative artificial intelligence everywhere days fact headlines may actually written generative ai like openais chatgpt chatbot demonstrated uncanny ability produce text seems written human people really mean say generative ai generative ai boom past years people talked ai typically talking machinelearning models learn make prediction based data instance models trained using millions examples predict whether certain xray shows signs tumor particular borrower likely default loan generativ,"['explained', 'generative', 'ai', 'quick', 'scan', 'headlines', 'makes', 'seem', 'like', 'generative', 'artificial', 'intelligence', 'everywhere', 'days', 'fact', 'headlines', 'may', 'actually', 'written', 'generative', 'ai', 'like', 'openais', 'chatgpt', 'chatbot', 'demonstrated', 'uncanny', 'ability', 'produce', 'text', 'seems', 'written', 'human', 'people', 'really', 'mean', 'say', 'generative', 'ai', 'generative', 'ai', 'boom', 'past', 'years', 'people', 'talked', 'ai', 'typically', 'talking', 'machinelearning', 'models', 'learn', 'make', 'prediction', 'based', 'data', 'instance', 'models', 'trained', 'using', 'millions', 'examples', 'predict', 'whether', 'certain', 'xray', 'shows', 'signs', 'tumor', 'particular', 'borrower', 'likely', 'default', 'loan', 'generativ']","['explained', 'generative', 'ai']"
mit engineers failurefinding mission,vehicle collision avoidance airline scheduling systems power supply grids many services rely managed computers autonomous systems grow complexity ubiquity could ways fail mit engineers developed approach paired autonomous system quickly identify range potential failures system deployed real world whats approach find fixes failures suggest repairs avoid system breakdowns team shown approach root failures variety simulated autonomous systems including small large power grid network aircraft collision avoidance system team rescue drones ro,https://news.mit.edu/2023/mit-engineers-failure-finding-algorithm-1109,"Thu, 09 Nov 2023 00:00:00 -0500",science,mit engineers failurefinding mission vehicle collision avoidance airline scheduling systems power supply grids many services rely managed computers autonomous systems grow complexity ubiquity could ways fail mit engineers developed approach paired autonomous system quickly identify range potential failures system deployed real world whats approach find fixes failures suggest repairs avoid system breakdowns team shown approach root failures variety simulated autonomous systems including small large power grid network aircraft collision avoidance system team rescue drones ro,"['mit', 'engineers', 'failurefinding', 'mission', 'vehicle', 'collision', 'avoidance', 'airline', 'scheduling', 'systems', 'power', 'supply', 'grids', 'many', 'services', 'rely', 'managed', 'computers', 'autonomous', 'systems', 'grow', 'complexity', 'ubiquity', 'could', 'ways', 'fail', 'mit', 'engineers', 'developed', 'approach', 'paired', 'autonomous', 'system', 'quickly', 'identify', 'range', 'potential', 'failures', 'system', 'deployed', 'real', 'world', 'whats', 'approach', 'find', 'fixes', 'failures', 'suggest', 'repairs', 'avoid', 'system', 'breakdowns', 'team', 'shown', 'approach', 'root', 'failures', 'variety', 'simulated', 'autonomous', 'systems', 'including', 'small', 'large', 'power', 'grid', 'network', 'aircraft', 'collision', 'avoidance', 'system', 'team', 'rescue', 'drones', 'ro']","['mit', 'engineers', 'failurefinding', 'mission']"
using ai optimize rapid neural imaging,connectomics ambitious field study seeks map intricate network animal brains undergoing growth spurt within span decade journeyed nascent stages discipline poised hopefully unlock enigmas cognition physical underpinning neuropathologies alzheimers diseasenbsp forefront use powerful electron microscopes researchers mit computer artificial intelligence laboratory csail samuel lichtman labs harvard university bestowed analytical prowess machine learning unlike traditional electron microscopy integrated ai serves brain learns specimen acquiring images intelligently focus,https://news.mit.edu/2023/using-ai-optimize-rapid-neural-imaging-1106,"Mon, 06 Nov 2023 13:00:00 -0500",science,using ai optimize rapid neural imaging connectomics ambitious field study seeks map intricate network animal brains undergoing growth spurt within span decade journeyed nascent stages discipline poised hopefully unlock enigmas cognition physical underpinning neuropathologies alzheimers diseasenbsp forefront use powerful electron microscopes researchers mit computer artificial intelligence laboratory csail samuel lichtman labs harvard university bestowed analytical prowess machine learning unlike traditional electron microscopy integrated ai serves brain learns specimen acquiring images intelligently focus,"['using', 'ai', 'optimize', 'rapid', 'neural', 'imaging', 'connectomics', 'ambitious', 'field', 'study', 'seeks', 'map', 'intricate', 'network', 'animal', 'brains', 'undergoing', 'growth', 'spurt', 'within', 'span', 'decade', 'journeyed', 'nascent', 'stages', 'discipline', 'poised', 'hopefully', 'unlock', 'enigmas', 'cognition', 'physical', 'underpinning', 'neuropathologies', 'alzheimers', 'diseasenbsp', 'forefront', 'use', 'powerful', 'electron', 'microscopes', 'researchers', 'mit', 'computer', 'artificial', 'intelligence', 'laboratory', 'csail', 'samuel', 'lichtman', 'labs', 'harvard', 'university', 'bestowed', 'analytical', 'prowess', 'machine', 'learning', 'unlike', 'traditional', 'electron', 'microscopy', 'integrated', 'ai', 'serves', 'brain', 'learns', 'specimen', 'acquiring', 'images', 'intelligently', 'focus']","['using', 'ai', 'optimize', 'rapid', 'neural', 'imaging']"
using language give robots better grasp openended world,imagine youre visiting friend abroad look inside fridge see would make great breakfast many items initially appear foreign one encased unfamiliar packaging containers despite visual distinctions begin understand one used pick needed inspired humans ability handle unfamiliar objects group mits computer artificial intelligence laboratory csail designed feature fields robotic manipulation f3rm system blends 2d images foundation model features 3d scenes help robots identify grasp nearby items f3rm interpret openended language prompts human,https://news.mit.edu/2023/using-language-give-robots-better-grasp-open-ended-world-1102,"Thu, 02 Nov 2023 16:25:00 -0400",science,using language give robots better grasp openended world imagine youre visiting friend abroad look inside fridge see would make great breakfast many items initially appear foreign one encased unfamiliar packaging containers despite visual distinctions begin understand one used pick needed inspired humans ability handle unfamiliar objects group mits computer artificial intelligence laboratory csail designed feature fields robotic manipulation f3rm system blends 2d images foundation model features 3d scenes help robots identify grasp nearby items f3rm interpret openended language prompts human,"['using', 'language', 'give', 'robots', 'better', 'grasp', 'openended', 'world', 'imagine', 'youre', 'visiting', 'friend', 'abroad', 'look', 'inside', 'fridge', 'see', 'would', 'make', 'great', 'breakfast', 'many', 'items', 'initially', 'appear', 'foreign', 'one', 'encased', 'unfamiliar', 'packaging', 'containers', 'despite', 'visual', 'distinctions', 'begin', 'understand', 'one', 'used', 'pick', 'needed', 'inspired', 'humans', 'ability', 'handle', 'unfamiliar', 'objects', 'group', 'mits', 'computer', 'artificial', 'intelligence', 'laboratory', 'csail', 'designed', 'feature', 'fields', 'robotic', 'manipulation', 'f3rm', 'system', 'blends', '2d', 'images', 'foundation', 'model', 'features', '3d', 'scenes', 'help', 'robots', 'identify', 'grasp', 'nearby', 'items', 'f3rm', 'interpret', 'openended', 'language', 'prompts', 'human']","['using', 'language', 'give', 'robots', 'better', 'grasp', 'openended', 'world']"
techniques efficiently accelerate sparse tensors massive ai models,researchers mit nvidia developed two techniques accelerate processing sparse tensors type data structure thats used highperformance computing tasks complementary techniques could result significant improvements performance energyefficiency systems like massive machinelearning models drive generative artificial intelligence tensors data structures used machinelearning models methods seek efficiently exploit whats known sparsity zero values tensors processing tensors one skip zeros save computation memory instance anything multiplied zero zero skip operation compress tensor zeros,https://news.mit.edu/2023/new-techniques-efficiently-accelerate-sparse-tensors-1030,"Mon, 30 Oct 2023 00:00:00 -0400",science,techniques efficiently accelerate sparse tensors massive ai models researchers mit nvidia developed two techniques accelerate processing sparse tensors type data structure thats used highperformance computing tasks complementary techniques could result significant improvements performance energyefficiency systems like massive machinelearning models drive generative artificial intelligence tensors data structures used machinelearning models methods seek efficiently exploit whats known sparsity zero values tensors processing tensors one skip zeros save computation memory instance anything multiplied zero zero skip operation compress tensor zeros,"['techniques', 'efficiently', 'accelerate', 'sparse', 'tensors', 'massive', 'ai', 'models', 'researchers', 'mit', 'nvidia', 'developed', 'two', 'techniques', 'accelerate', 'processing', 'sparse', 'tensors', 'type', 'data', 'structure', 'thats', 'used', 'highperformance', 'computing', 'tasks', 'complementary', 'techniques', 'could', 'result', 'significant', 'improvements', 'performance', 'energyefficiency', 'systems', 'like', 'massive', 'machinelearning', 'models', 'drive', 'generative', 'artificial', 'intelligence', 'tensors', 'data', 'structures', 'used', 'machinelearning', 'models', 'methods', 'seek', 'efficiently', 'exploit', 'whats', 'known', 'sparsity', 'zero', 'values', 'tensors', 'processing', 'tensors', 'one', 'skip', 'zeros', 'save', 'computation', 'memory', 'instance', 'anything', 'multiplied', 'zero', 'zero', 'skip', 'operation', 'compress', 'tensor', 'zeros']","['techniques', 'efficiently', 'accelerate', 'sparse', 'tensors', 'massive', 'ai', 'models']"
accelerating ai tasks preserving data security,proliferation computationally intensive machinelearning applications chatbots perform realtime language translation device manufacturers often incorporate specialized hardware components rapidly move process massive amounts data systems demand choosing best design components known deep neural network accelerators challenging enormous range design options difficult problem becomes even thornier designer seeks add cryptographic operations keep data safe attackers mit researchers developed search engine efficiently identify optimal designs deep neural network accelerators preserve data security boosting performance,https://news.mit.edu/2023/accelerating-ai-tasks-while-preserving-data-security-1030,"Mon, 30 Oct 2023 00:00:00 -0400",science,accelerating ai tasks preserving data security proliferation computationally intensive machinelearning applications chatbots perform realtime language translation device manufacturers often incorporate specialized hardware components rapidly move process massive amounts data systems demand choosing best design components known deep neural network accelerators challenging enormous range design options difficult problem becomes even thornier designer seeks add cryptographic operations keep data safe attackers mit researchers developed search engine efficiently identify optimal designs deep neural network accelerators preserve data security boosting performance,"['accelerating', 'ai', 'tasks', 'preserving', 'data', 'security', 'proliferation', 'computationally', 'intensive', 'machinelearning', 'applications', 'chatbots', 'perform', 'realtime', 'language', 'translation', 'device', 'manufacturers', 'often', 'incorporate', 'specialized', 'hardware', 'components', 'rapidly', 'move', 'process', 'massive', 'amounts', 'data', 'systems', 'demand', 'choosing', 'best', 'design', 'components', 'known', 'deep', 'neural', 'network', 'accelerators', 'challenging', 'enormous', 'range', 'design', 'options', 'difficult', 'problem', 'becomes', 'even', 'thornier', 'designer', 'seeks', 'add', 'cryptographic', 'operations', 'keep', 'data', 'safe', 'attackers', 'mit', 'researchers', 'developed', 'search', 'engine', 'efficiently', 'identify', 'optimal', 'designs', 'deep', 'neural', 'network', 'accelerators', 'preserve', 'data', 'security', 'boosting', 'performance']","['accelerating', 'ai', 'tasks', 'preserving', 'data', 'security']"
