Title,Body,Link,Date,Type,Combined_Text,PText,PTitle
batista brothers make debut oil acquisition,brazilian billionaire brothers wesley joesley batista making debut oil gas industry family company grupo jampfs acquisition fluxus agreed take production assets argentina,https://www.bloomberg.com/news/articles/2023-12-01/billionaire-batista-brothers-make-debut-in-oil-with-acquisition,"Fri, 01 Dec 2023 18:38:28 GMT",finance,batista brothers make debut oil acquisition brazilian billionaire brothers wesley joesley batista making debut oil gas industry family company grupo jampfs acquisition fluxus agreed take production assets argentina,"['batista', 'brothers', 'make', 'debut', 'oil', 'acquisition', 'brazilian', 'billionaire', 'brothers', 'wesley', 'joesley', 'batista', 'making', 'debut', 'oil', 'gas', 'industry', 'family', 'company', 'grupo', 'jampfs', 'acquisition', 'fluxus', 'agreed', 'take', 'production', 'assets', 'argentina']","['batista', 'brothers', 'make', 'debut', 'oil', 'acquisition']"
wall street week diplomats gone,,https://www.bloomberg.com/news/newsletters/2023-12-02/kissinger-s-death-leaves-a-gap-where-have-all-the-diplomats-gone,"Sat, 02 Dec 2023 13:00:05 GMT",finance,wall street week diplomats gone ,"['wall', 'street', 'week', 'diplomats', 'gone']","['wall', 'street', 'week', 'diplomats', 'gone']"
kenya consider sovereign green bonds fund climate projects,kenya weighing selling sovereign green bonds debtfornature swap deals fund climate projects president william ruto said,https://www.bloomberg.com/news/articles/2023-12-02/kenya-to-consider-sovereign-green-bonds-to-fund-climate-projects,"Sat, 02 Dec 2023 12:20:08 GMT",finance,kenya consider sovereign green bonds fund climate projects kenya weighing selling sovereign green bonds debtfornature swap deals fund climate projects president william ruto said,"['kenya', 'consider', 'sovereign', 'green', 'bonds', 'fund', 'climate', 'projects', 'kenya', 'weighing', 'selling', 'sovereign', 'green', 'bonds', 'debtfornature', 'swap', 'deals', 'fund', 'climate', 'projects', 'president', 'william', 'ruto', 'said']","['kenya', 'consider', 'sovereign', 'green', 'bonds', 'fund', 'climate', 'projects']"
erdogan says top bank executives probed soccer fraud case,denizbank ass top executives probed connection highprofile fraud case involving prominent footballers president recep tayyip erdogan said,https://www.bloomberg.com/news/articles/2023-12-02/erdogan-says-top-bank-executives-probed-in-soccer-fraud-case,"Sat, 02 Dec 2023 12:00:07 GMT",finance,erdogan says top bank executives probed soccer fraud case denizbank ass top executives probed connection highprofile fraud case involving prominent footballers president recep tayyip erdogan said,"['erdogan', 'says', 'top', 'bank', 'executives', 'probed', 'soccer', 'fraud', 'case', 'denizbank', 'ass', 'top', 'executives', 'probed', 'connection', 'highprofile', 'fraud', 'case', 'involving', 'prominent', 'footballers', 'president', 'recep', 'tayyip', 'erdogan', 'said']","['erdogan', 'says', 'top', 'bank', 'executives', 'probed', 'soccer', 'fraud', 'case']"
venezuela stirs nationalism dispute oilrich territory,decades venezuelan schoolchildren taught draw map country different one use elsewhere includes disputed region roughly size florida controlled neighboring guyana,https://www.bloomberg.com/news/articles/2023-12-02/venezuela-stirs-nationalism-in-dispute-over-oil-rich-territory,"Sat, 02 Dec 2023 12:00:00 GMT",finance,venezuela stirs nationalism dispute oilrich territory decades venezuelan schoolchildren taught draw map country different one use elsewhere includes disputed region roughly size florida controlled neighboring guyana,"['venezuela', 'stirs', 'nationalism', 'dispute', 'oilrich', 'territory', 'decades', 'venezuelan', 'schoolchildren', 'taught', 'draw', 'map', 'country', 'different', 'one', 'use', 'elsewhere', 'includes', 'disputed', 'region', 'roughly', 'size', 'florida', 'controlled', 'neighboring', 'guyana']","['venezuela', 'stirs', 'nationalism', 'dispute', 'oilrich', 'territory']"
eu south america trade agreement postponed milei awaited,major trade deal european union latin american economies wont signed next week hoped additional commitments require approval argentinas incoming president javier milei,https://www.bloomberg.com/news/articles/2023-12-02/eu-south-america-trade-agreement-postponed-as-milei-awaited,"Sat, 02 Dec 2023 11:34:33 GMT",finance,eu south america trade agreement postponed milei awaited major trade deal european union latin american economies wont signed next week hoped additional commitments require approval argentinas incoming president javier milei,"['eu', 'south', 'america', 'trade', 'agreement', 'postponed', 'milei', 'awaited', 'major', 'trade', 'deal', 'european', 'union', 'latin', 'american', 'economies', 'wont', 'signed', 'next', 'week', 'hoped', 'additional', 'commitments', 'require', 'approval', 'argentinas', 'incoming', 'president', 'javier', 'milei']","['eu', 'south', 'america', 'trade', 'agreement', 'postponed', 'milei', 'awaited']"
industries stuck transition traps get support un,industries account third greenhouse gas emissions target new initiative seeking decarbonize heavyemitting sectors,https://www.bloomberg.com/news/articles/2023-12-02/industries-stuck-in-transition-traps-get-support-from-un,"Sat, 02 Dec 2023 11:30:00 GMT",finance,industries stuck transition traps get support un industries account third greenhouse gas emissions target new initiative seeking decarbonize heavyemitting sectors,"['industries', 'stuck', 'transition', 'traps', 'get', 'support', 'un', 'industries', 'account', 'third', 'greenhouse', 'gas', 'emissions', 'target', 'new', 'initiative', 'seeking', 'decarbonize', 'heavyemitting', 'sectors']","['industries', 'stuck', 'transition', 'traps', 'get', 'support', 'un']"
scandalhit cbi group seeks higher fees members sky says,scandalhit confederation british industry seeking higher fees members lobby group battles rebuild reputation according sky news,https://www.bloomberg.com/news/articles/2023-12-02/scandal-hit-cbi-group-seeks-higher-fees-from-members-sky-says,"Sat, 02 Dec 2023 10:47:52 GMT",finance,scandalhit cbi group seeks higher fees members sky says scandalhit confederation british industry seeking higher fees members lobby group battles rebuild reputation according sky news,"['scandalhit', 'cbi', 'group', 'seeks', 'higher', 'fees', 'members', 'sky', 'says', 'scandalhit', 'confederation', 'british', 'industry', 'seeking', 'higher', 'fees', 'members', 'lobby', 'group', 'battles', 'rebuild', 'reputation', 'according', 'sky', 'news']","['scandalhit', 'cbi', 'group', 'seeks', 'higher', 'fees', 'members', 'sky', 'says']"
turkeys trade deficit narrows imports fall weak demand,turkeys trade deficit narrowed yet november propelled drop imports rise exports fifth consecutive month,https://www.bloomberg.com/news/articles/2023-12-02/turkey-s-trade-deficit-narrows-as-imports-fall-on-weak-demand,"Sat, 02 Dec 2023 10:45:30 GMT",finance,turkeys trade deficit narrows imports fall weak demand turkeys trade deficit narrowed yet november propelled drop imports rise exports fifth consecutive month,"['turkeys', 'trade', 'deficit', 'narrows', 'imports', 'fall', 'weak', 'demand', 'turkeys', 'trade', 'deficit', 'narrowed', 'yet', 'november', 'propelled', 'drop', 'imports', 'rise', 'exports', 'fifth', 'consecutive', 'month']","['turkeys', 'trade', 'deficit', 'narrows', 'imports', 'fall', 'weak', 'demand']"
charting global economy growth slowing around world,worlds advanced economies heading deepening slowdown markedly higher interest rates take hefty toll activity could still become acute oecd warned,https://www.bloomberg.com/news/articles/2023-12-02/world-economy-latest-growth-is-slowing-around-the-world,"Sat, 02 Dec 2023 10:00:00 GMT",finance,charting global economy growth slowing around world worlds advanced economies heading deepening slowdown markedly higher interest rates take hefty toll activity could still become acute oecd warned,"['charting', 'global', 'economy', 'growth', 'slowing', 'around', 'world', 'worlds', 'advanced', 'economies', 'heading', 'deepening', 'slowdown', 'markedly', 'higher', 'interest', 'rates', 'take', 'hefty', 'toll', 'activity', 'could', 'still', 'become', 'acute', 'oecd', 'warned']","['charting', 'global', 'economy', 'growth', 'slowing', 'around', 'world']"
thames water may run april group auditor warns,thames waters parent company may run april shareholders dont inject equity debtladen utility auditors warned,https://www.bloomberg.com/news/articles/2023-12-02/thames-water-may-run-out-of-money-by-april-group-auditor-warns,"Sat, 02 Dec 2023 08:03:59 GMT",finance,thames water may run april group auditor warns thames waters parent company may run april shareholders dont inject equity debtladen utility auditors warned,"['thames', 'water', 'may', 'run', 'april', 'group', 'auditor', 'warns', 'thames', 'waters', 'parent', 'company', 'may', 'run', 'april', 'shareholders', 'dont', 'inject', 'equity', 'debtladen', 'utility', 'auditors', 'warned']","['thames', 'water', 'may', 'run', 'april', 'group', 'auditor', 'warns']"
rising dubai raises questions direction london,,https://www.bloomberg.com/news/articles/2023-12-02/london-property-market-slows-while-dubai-real-estate-gains-ground,"Sat, 02 Dec 2023 07:49:01 GMT",finance,rising dubai raises questions direction london ,"['rising', 'dubai', 'raises', 'questions', 'direction', 'london']","['rising', 'dubai', 'raises', 'questions', 'direction', 'london']"
vietnam orders central bank probe slow loans media say,vietnam ordered rare inspection state bank vietnam oversight efforts speed loans businesses according local media report prime minister pham minh chinh ramps pressure central bank,https://www.bloomberg.com/news/articles/2023-12-02/vietnam-probes-central-bank-s-handling-of-credit-growth-media,"Sat, 02 Dec 2023 03:28:25 GMT",finance,vietnam orders central bank probe slow loans media say vietnam ordered rare inspection state bank vietnam oversight efforts speed loans businesses according local media report prime minister pham minh chinh ramps pressure central bank,"['vietnam', 'orders', 'central', 'bank', 'probe', 'slow', 'loans', 'media', 'say', 'vietnam', 'ordered', 'rare', 'inspection', 'state', 'bank', 'vietnam', 'oversight', 'efforts', 'speed', 'loans', 'businesses', 'according', 'local', 'media', 'report', 'prime', 'minister', 'pham', 'minh', 'chinh', 'ramps', 'pressure', 'central', 'bank']","['vietnam', 'orders', 'central', 'bank', 'probe', 'slow', 'loans', 'media', 'say']"
france loans 218 million mauritius watersector projects,frances development agency provide 200 million euro 2177 million budgetary loan mauritius finance overhaul countrys water sector,https://www.bloomberg.com/news/articles/2023-12-02/france-loans-218-million-to-mauritius-for-water-sector-projects,"Sat, 02 Dec 2023 07:19:58 GMT",finance,france loans 218 million mauritius watersector projects frances development agency provide 200 million euro 2177 million budgetary loan mauritius finance overhaul countrys water sector,"['france', 'loans', '218', 'million', 'mauritius', 'watersector', 'projects', 'frances', 'development', 'agency', 'provide', '200', 'million', 'euro', '2177', 'million', 'budgetary', 'loan', 'mauritius', 'finance', 'overhaul', 'countrys', 'water', 'sector']","['france', 'loans', '218', 'million', 'mauritius', 'watersector', 'projects']"
swedish home prices fall months stabilization,housing prices sweden resumed decline nordic nations economy recession borrowing costs continue rising,https://www.bloomberg.com/news/articles/2023-12-02/swedish-home-prices-fall-again-after-months-of-stabilization,"Sat, 02 Dec 2023 07:00:00 GMT",finance,swedish home prices fall months stabilization housing prices sweden resumed decline nordic nations economy recession borrowing costs continue rising,"['swedish', 'home', 'prices', 'fall', 'months', 'stabilization', 'housing', 'prices', 'sweden', 'resumed', 'decline', 'nordic', 'nations', 'economy', 'recession', 'borrowing', 'costs', 'continue', 'rising']","['swedish', 'home', 'prices', 'fall', 'months', 'stabilization']"
swiss immigration fears risk crashing eu talks,switzerland make another push improve fractured relationship european union plan pressure even begun,https://www.bloomberg.com/news/articles/2023-12-02/swiss-immigration-fears-risk-crashing-eu-talks-once-again,"Sat, 02 Dec 2023 07:00:00 GMT",finance,swiss immigration fears risk crashing eu talks switzerland make another push improve fractured relationship european union plan pressure even begun,"['swiss', 'immigration', 'fears', 'risk', 'crashing', 'eu', 'talks', 'switzerland', 'make', 'another', 'push', 'improve', 'fractured', 'relationship', 'european', 'union', 'plan', 'pressure', 'even', 'begun']","['swiss', 'immigration', 'fears', 'risk', 'crashing', 'eu', 'talks']"
hong kong cuts public housing waiting time boost birth rates,hong kong reduced waiting time public housing applicants newborn babies effort support birth rates city,https://www.bloomberg.com/news/articles/2023-12-02/hong-kong-cuts-public-housing-waiting-time-to-boost-birth-rates,"Sat, 02 Dec 2023 04:08:54 GMT",finance,hong kong cuts public housing waiting time boost birth rates hong kong reduced waiting time public housing applicants newborn babies effort support birth rates city,"['hong', 'kong', 'cuts', 'public', 'housing', 'waiting', 'time', 'boost', 'birth', 'rates', 'hong', 'kong', 'reduced', 'waiting', 'time', 'public', 'housing', 'applicants', 'newborn', 'babies', 'effort', 'support', 'birth', 'rates', 'city']","['hong', 'kong', 'cuts', 'public', 'housing', 'waiting', 'time', 'boost', 'birth', 'rates']"
authenticity struggles,,https://www.bloomberg.com/news/videos/2023-12-02/authenticity-struggles,"Sat, 02 Dec 2023 01:31:29 GMT",finance,authenticity struggles ,"['authenticity', 'struggles']","['authenticity', 'struggles']"
fossil fuel companies sign emissions reduction pact un climate conference,,https://www.ft.com/content/4a43c5ea-30d0-4c28-b535-e8f38ba0d8a9,"Sat, 02 Dec 2023 15:59:18 GMT",finance,fossil fuel companies sign emissions reduction pact un climate conference ,"['fossil', 'fuel', 'companies', 'sign', 'emissions', 'reduction', 'pact', 'un', 'climate', 'conference']","['fossil', 'fuel', 'companies', 'sign', 'emissions', 'reduction', 'pact', 'un', 'climate', 'conference']"
top ecb official wants give risk managers power bank bonuses,,https://www.ft.com/content/729eda78-2e5a-40f0-a3a4-0e7d5c2c5cfd,"Sat, 02 Dec 2023 13:00:02 GMT",finance,top ecb official wants give risk managers power bank bonuses ,"['top', 'ecb', 'official', 'wants', 'give', 'risk', 'managers', 'power', 'bank', 'bonuses']","['top', 'ecb', 'official', 'wants', 'give', 'risk', 'managers', 'power', 'bank', 'bonuses']"
wall street fear gauge tumbles investors spy end feds inflation fight,,https://www.ft.com/content/8202fc60-4ee0-4bbe-bda0-3f8d40bd8853,"Sat, 02 Dec 2023 13:00:02 GMT",finance,wall street fear gauge tumbles investors spy end feds inflation fight ,"['wall', 'street', 'fear', 'gauge', 'tumbles', 'investors', 'spy', 'end', 'feds', 'inflation', 'fight']","['wall', 'street', 'fear', 'gauge', 'tumbles', 'investors', 'spy', 'end', 'feds', 'inflation', 'fight']"
un climate talks focused renewable energy long exxon chief says,,https://www.ft.com/content/2217ab4a-2cae-4f4b-9ae0-124f209705da,"Sat, 02 Dec 2023 12:02:46 GMT",finance,un climate talks focused renewable energy long exxon chief says ,"['un', 'climate', 'talks', 'focused', 'renewable', 'energy', 'long', 'exxon', 'chief', 'says']","['un', 'climate', 'talks', 'focused', 'renewable', 'energy', 'long', 'exxon', 'chief', 'says']"
uk digital pound could put financial stability privacy risk mps warn,,https://www.ft.com/content/77c4df6d-40f3-4d64-8c44-6fb1948709c6,"Sat, 02 Dec 2023 11:16:17 GMT",finance,uk digital pound could put financial stability privacy risk mps warn ,"['uk', 'digital', 'pound', 'could', 'put', 'financial', 'stability', 'privacy', 'risk', 'mps', 'warn']","['uk', 'digital', 'pound', 'could', 'put', 'financial', 'stability', 'privacy', 'risk', 'mps', 'warn']"
somerset capital management hit loss largest client,,https://www.ft.com/content/eda08e19-e772-4bcf-96b5-7f7bc73ffd3e,"Sat, 02 Dec 2023 10:00:05 GMT",finance,somerset capital management hit loss largest client ,"['somerset', 'capital', 'management', 'hit', 'loss', 'largest', 'client']","['somerset', 'capital', 'management', 'hit', 'loss', 'largest', 'client']"
sustainability real smart investors know,,https://www.ft.com/content/5593c78d-aa22-4dc2-bef5-d98f72288482,"Sat, 02 Dec 2023 05:00:40 GMT",finance,sustainability real smart investors know ,"['sustainability', 'real', 'smart', 'investors', 'know']","['sustainability', 'real', 'smart', 'investors', 'know']"
investor lovein bonds revives rocky times,,https://www.ft.com/content/3b925ab5-9e67-4d28-a7f1-e078d5434d15,"Fri, 01 Dec 2023 20:23:02 GMT",finance,investor lovein bonds revives rocky times ,"['investor', 'lovein', 'bonds', 'revives', 'rocky', 'times']","['investor', 'lovein', 'bonds', 'revives', 'rocky', 'times']"
corporate cash friday chartfest,,https://www.ft.com/content/6667164e-546e-49b2-9ef4-651cf778825c,"Fri, 01 Dec 2023 19:16:50 GMT",finance,corporate cash friday chartfest ,"['corporate', 'cash', 'friday', 'chartfest']","['corporate', 'cash', 'friday', 'chartfest']"
charlie munger magnificent seven,,https://www.ft.com/content/89af115c-d9d6-4814-99e5-267f269f7481,"Fri, 01 Dec 2023 17:37:43 GMT",finance,charlie munger magnificent seven ,"['charlie', 'munger', 'magnificent', 'seven']","['charlie', 'munger', 'magnificent', 'seven']"
venezuela hold referendum seizing part guyana oil,,https://www.ft.com/content/a0ec9710-aa52-416b-ac79-8ada5cdab229,"Fri, 01 Dec 2023 15:58:26 GMT",finance,venezuela hold referendum seizing part guyana oil ,"['venezuela', 'hold', 'referendum', 'seizing', 'part', 'guyana', 'oil']","['venezuela', 'hold', 'referendum', 'seizing', 'part', 'guyana', 'oil']"
tokenised securities blockchain offers lower cost faster speed,,https://www.ft.com/content/c3a40719-b096-4767-8bd8-2a7da27c3a94,"Fri, 01 Dec 2023 15:10:20 GMT",finance,tokenised securities blockchain offers lower cost faster speed ,"['tokenised', 'securities', 'blockchain', 'offers', 'lower', 'cost', 'faster', 'speed']","['tokenised', 'securities', 'blockchain', 'offers', 'lower', 'cost', 'faster', 'speed']"
hmrc urges crypto holders disclose gains,,https://www.ft.com/content/25de9ccb-825c-4aa0-9d0e-0d0bcb34630c,"Fri, 01 Dec 2023 14:51:44 GMT",finance,hmrc urges crypto holders disclose gains ,"['hmrc', 'urges', 'crypto', 'holders', 'disclose', 'gains']","['hmrc', 'urges', 'crypto', 'holders', 'disclose', 'gains']"
cop28 help readers,,https://www.ft.com/content/bfbe6f9e-89d7-4027-ade1-687b9e8a5331,"Fri, 01 Dec 2023 13:03:23 GMT",finance,cop28 help readers ,"['cop28', 'help', 'readers']","['cop28', 'help', 'readers']"
us puts stablecoin market notice,,https://www.ft.com/content/7e0204e9-4bfb-4090-b5c8-8c97baa5a3ff,"Fri, 01 Dec 2023 13:00:12 GMT",finance,us puts stablecoin market notice ,"['us', 'puts', 'stablecoin', 'market', 'notice']","['us', 'puts', 'stablecoin', 'market', 'notice']"
good time rick rieder,,https://www.ft.com/content/6a3bc28f-f612-4d31-87f6-f1bb39764778,"Fri, 01 Dec 2023 06:30:16 GMT",finance,good time rick rieder ,"['good', 'time', 'rick', 'rieder']","['good', 'time', 'rick', 'rieder']"
us aims halve russias energy revenues 2030 says official,,https://www.ft.com/content/277c1f9c-3f0f-4562-b0f0-80b390012087,"Fri, 01 Dec 2023 05:00:17 GMT",finance,us aims halve russias energy revenues 2030 says official ,"['us', 'aims', 'halve', 'russias', 'energy', 'revenues', '2030', 'says', 'official']","['us', 'aims', 'halve', 'russias', 'energy', 'revenues', '2030', 'says', 'official']"
yesterdays company heroes move recovery mode,,https://www.ft.com/content/4995116d-2c31-4dec-9481-3d1408bbb4d9,"Fri, 01 Dec 2023 05:00:17 GMT",finance,yesterdays company heroes move recovery mode ,"['yesterdays', 'company', 'heroes', 'move', 'recovery', 'mode']","['yesterdays', 'company', 'heroes', 'move', 'recovery', 'mode']"
brookfield raises 28bn largestever infrastructure fund,,https://www.ft.com/content/766b702e-acdf-4e71-ab9e-664e30611e83,"Fri, 01 Dec 2023 05:00:17 GMT",finance,brookfield raises 28bn largestever infrastructure fund ,"['brookfield', 'raises', '28bn', 'largestever', 'infrastructure', 'fund']","['brookfield', 'raises', '28bn', 'largestever', 'infrastructure', 'fund']"
falling corn prices heap pressure farmers,,https://www.ft.com/content/29b0fefa-4629-4dd2-8b04-2be4202b3df8,"Fri, 01 Dec 2023 05:00:17 GMT",finance,falling corn prices heap pressure farmers ,"['falling', 'corn', 'prices', 'heap', 'pressure', 'farmers']","['falling', 'corn', 'prices', 'heap', 'pressure', 'farmers']"
blackrock caps fee 10bn highyield corporate bond etf,,https://www.ft.com/content/2f699b94-d433-4176-b59d-142b2b57dabd,"Fri, 01 Dec 2023 05:00:16 GMT",finance,blackrock caps fee 10bn highyield corporate bond etf ,"['blackrock', 'caps', 'fee', '10bn', 'highyield', 'corporate', 'bond', 'etf']","['blackrock', 'caps', 'fee', '10bn', 'highyield', 'corporate', 'bond', 'etf']"
markets stellar november,,https://www.ft.com/content/7316cfcd-782b-4b49-b0f8-2d6dcb3e3977,"Fri, 01 Dec 2023 05:00:07 GMT",finance,markets stellar november ,"['markets', 'stellar', 'november']","['markets', 'stellar', 'november']"
jabs panera brands files confidential ipo paperwork,,https://www.ft.com/content/77dceb43-e5f7-40ae-bb33-f15ea1b58386,"Fri, 01 Dec 2023 00:43:21 GMT",finance,jabs panera brands files confidential ipo paperwork ,"['jabs', 'panera', 'brands', 'files', 'confidential', 'ipo', 'paperwork']","['jabs', 'panera', 'brands', 'files', 'confidential', 'ipo', 'paperwork']"
global record best month three years rate cut hopes,,https://www.ft.com/content/a061bd16-6d8a-4c65-ae23-86af9d6603f6,"Thu, 30 Nov 2023 21:35:52 GMT",finance,global record best month three years rate cut hopes ,"['global', 'record', 'best', 'month', 'three', 'years', 'rate', 'cut', 'hopes']","['global', 'record', 'best', 'month', 'three', 'years', 'rate', 'cut', 'hopes']"
2024 prediction 65 dividend go cheap pricey,,https://www.forbes.com/sites/michaelfoster/2023/12/02/2024-prediction-this-65-dividend-will-go-from-cheap-to-pricey/,"Sat, 02 Dec 2023 08:45:00 -0500",finance,2024 prediction 65 dividend go cheap pricey ,"['2024', 'prediction', '65', 'dividend', 'go', 'cheap', 'pricey']","['2024', 'prediction', '65', 'dividend', 'go', 'cheap', 'pricey']"
index fund vs mutual funds understanding key differences,,https://www.forbes.com/sites/investor-hub/article/index-fund-vs-mutual-funds/,"Fri, 01 Dec 2023 15:20:00 -0500",finance,index fund vs mutual funds understanding key differences ,"['index', 'fund', 'vs', 'mutual', 'funds', 'understanding', 'key', 'differences']","['index', 'fund', 'vs', 'mutual', 'funds', 'understanding', 'key', 'differences']"
bidens next tech export controls target uncertain,finalizing semiconductor export controls president biden may look next unclear leaving lawmakers lobbyists looking make mark,https://www.forbes.com/sites/owentedford/2023/12/01/bidens-next-export-controls-targets-are-uncertain/,"Fri, 01 Dec 2023 14:19:09 -0500",finance,bidens next tech export controls target uncertain finalizing semiconductor export controls president biden may look next unclear leaving lawmakers lobbyists looking make mark,"['bidens', 'next', 'tech', 'export', 'controls', 'target', 'uncertain', 'finalizing', 'semiconductor', 'export', 'controls', 'president', 'biden', 'may', 'look', 'next', 'unclear', 'leaving', 'lawmakers', 'lobbyists', 'looking', 'make', 'mark']","['bidens', 'next', 'tech', 'export', 'controls', 'target', 'uncertain']"
powell warns premature discuss interest rate cutsdespite markets newfound optimism,,https://www.forbes.com/sites/dereksaul/2023/12/01/powell-warns-its-premature-to-discuss-interest-rate-cuts-despite-markets-newfound-optimism/,"Fri, 01 Dec 2023 12:10:15 -0500",finance,powell warns premature discuss interest rate cutsdespite markets newfound optimism ,"['powell', 'warns', 'premature', 'discuss', 'interest', 'rate', 'cutsdespite', 'markets', 'newfound', 'optimism']","['powell', 'warns', 'premature', 'discuss', 'interest', 'rate', 'cutsdespite', 'markets', 'newfound', 'optimism']"
rate expectations 2024 fed cut,,https://www.forbes.com/sites/bradmcmillan/2023/12/01/rate-expectations-for-2024-will-the-fed-cut/,"Fri, 01 Dec 2023 10:43:00 -0500",finance,rate expectations 2024 fed cut ,"['rate', 'expectations', '2024', 'fed', 'cut']","['rate', 'expectations', '2024', 'fed', 'cut']"
reminder schlumberger goes exdividend soon,,https://www.forbes.com/sites/dividendchannel/2023/12/01/reminderschlumberger-goes-ex-dividend-soon/,"Fri, 01 Dec 2023 10:35:13 -0500",finance,reminder schlumberger goes exdividend soon ,"['reminder', 'schlumberger', 'goes', 'exdividend', 'soon']","['reminder', 'schlumberger', 'goes', 'exdividend', 'soon']"
look cannabis 2023,,https://www.forbes.com/sites/lewiskoski/2023/12/01/a-look-at-cannabis-in-2023/,"Fri, 01 Dec 2023 09:15:00 -0500",finance,look cannabis 2023 ,"['look', 'cannabis', '2023']","['look', 'cannabis', '2023']"
