Title,Body,Link,Date,Type,Combined_Text,PText,PTitle
10 github repositories master,blog covers bootcamps books tools interview questions cheat sheets mlops platforms master ml secure dream job,https://www.kdnuggets.com/10-github-repositories-to-master-machine-learning?utm_source=rss&utm_medium=rss&utm_campaign=10-github-repositories-to-master-machine-learning,"Fri, 01 Dec 2023 17:00:02 +0000",blogml,10 github repositories master blog covers bootcamps books tools interview questions cheat sheets mlops platforms master ml secure dream job,"['10', 'github', 'repositories', 'master', 'blog', 'covers', 'bootcamps', 'books', 'tools', 'interview', 'questions', 'cheat', 'sheets', 'mlops', 'platforms', 'master', 'ml', 'secure', 'dream', 'job']","['10', 'github', 'repositories', 'master']"
mit course tinyml efficient deep computing,curious optimizing ai everyday devices dive complete overview mits tinyml efficient deep computing course explore strategies make ai smarter small devices read full article indepth look,https://www.kdnuggets.com/free-mit-course-tinyml-and-efficient-deep-learning-computing?utm_source=rss&utm_medium=rss&utm_campaign=free-mit-course-tinyml-and-efficient-deep-learning-computing,"Fri, 01 Dec 2023 15:00:05 +0000",blogml,mit course tinyml efficient deep computing curious optimizing ai everyday devices dive complete overview mits tinyml efficient deep computing course explore strategies make ai smarter small devices read full article indepth look,"['mit', 'course', 'tinyml', 'efficient', 'deep', 'computing', 'curious', 'optimizing', 'ai', 'everyday', 'devices', 'dive', 'complete', 'overview', 'mits', 'tinyml', 'efficient', 'deep', 'computing', 'course', 'explore', 'strategies', 'make', 'ai', 'smarter', 'small', 'devices', 'read', 'full', 'article', 'indepth', 'look']","['mit', 'course', 'tinyml', 'efficient', 'deep', 'computing']"
building predictive logistic regression,want learn build predictive logistic regression tutorial covers logistic regression depth theory math code build better,https://www.kdnuggets.com/building-predictive-models-logistic-regression-in-python?utm_source=rss&utm_medium=rss&utm_campaign=building-predictive-models-logistic-regression-in-python,"Fri, 01 Dec 2023 13:00:35 +0000",blogml,building predictive logistic regression want learn build predictive logistic regression tutorial covers logistic regression depth theory math code build better,"['building', 'predictive', 'logistic', 'regression', 'want', 'learn', 'build', 'predictive', 'logistic', 'regression', 'tutorial', 'covers', 'logistic', 'regression', 'depth', 'theory', 'math', 'code', 'build', 'better']","['building', 'predictive', 'logistic', 'regression']"
top 5 alternatives github projects,blog discusses five platforms designed scientists specialized capabilities managing large sets workflows collaboration beyond github offers,https://www.kdnuggets.com/the-top-5-alternatives-to-github-for-data-science-projects?utm_source=rss&utm_medium=rss&utm_campaign=the-top-5-alternatives-to-github-for-data-science-projects,"Thu, 30 Nov 2023 15:00:47 +0000",blogml,top 5 alternatives github projects blog discusses five platforms designed scientists specialized capabilities managing large sets workflows collaboration beyond github offers,"['top', '5', 'alternatives', 'github', 'projects', 'blog', 'discusses', 'five', 'platforms', 'designed', 'scientists', 'specialized', 'capabilities', 'managing', 'large', 'sets', 'workflows', 'collaboration', 'beyond', 'github', 'offers']","['top', '5', 'alternatives', 'github', 'projects']"
5 master engineering,,https://www.kdnuggets.com/5-free-courses-to-master-data-engineering?utm_source=rss&utm_medium=rss&utm_campaign=5-free-courses-to-master-data-engineering,"Thu, 30 Nov 2023 13:00:16 +0000",blogml,5 master engineering ,"['5', 'master', 'engineering']","['5', 'master', 'engineering']"
kdnuggets news november 29 5 master stunning viz chatgpt,,https://www.kdnuggets.com/newsletter-n43-2023-11-29?utm_source=rss&utm_medium=rss&utm_campaign=kdnuggets-news-november-29-5-free-courses-to-master-machine-learning-stunning-data-viz-with-chatgpt,"Wed, 29 Nov 2023 19:00:45 +0000",blogml,kdnuggets news november 29 5 master stunning viz chatgpt ,"['kdnuggets', 'news', 'november', '29', '5', 'master', 'stunning', 'viz', 'chatgpt']","['kdnuggets', 'news', 'november', '29', '5', 'master', 'stunning', 'viz', 'chatgpt']"
building gpu vs gpu cloud,article examines pros cons building onpremise gpu versus gpu cloud service projects involving deep analyzing factors like cost performance operations scalability,https://www.kdnuggets.com/building-a-gpu-machine-vs-using-the-gpu-cloud?utm_source=rss&utm_medium=rss&utm_campaign=building-a-gpu-machine-vs-using-the-gpu-cloud,"Wed, 29 Nov 2023 17:00:37 +0000",blogml,building gpu vs gpu cloud article examines pros cons building onpremise gpu versus gpu cloud service projects involving deep analyzing factors like cost performance operations scalability,"['building', 'gpu', 'vs', 'gpu', 'cloud', 'article', 'examines', 'pros', 'cons', 'building', 'onpremise', 'gpu', 'versus', 'gpu', 'cloud', 'service', 'projects', 'involving', 'deep', 'analyzing', 'factors', 'like', 'cost', 'performance', 'operations', 'scalability']","['building', 'gpu', 'vs', 'gpu', 'cloud']"
learn probability computer stanford university,probability one foundational elements computer bootcamps skim topic however integral computer knowledge,https://www.kdnuggets.com/learn-probability-in-computer-science-with-stanford-university-for-free?utm_source=rss&utm_medium=rss&utm_campaign=learn-probability-in-computer-science-with-stanford-university-for-free,"Wed, 29 Nov 2023 15:00:42 +0000",blogml,learn probability computer stanford university probability one foundational elements computer bootcamps skim topic however integral computer knowledge,"['learn', 'probability', 'computer', 'stanford', 'university', 'probability', 'one', 'foundational', 'elements', 'computer', 'bootcamps', 'skim', 'topic', 'however', 'integral', 'computer', 'knowledge']","['learn', 'probability', 'computer', 'stanford', 'university']"
beyond human boundaries rise super,,https://www.kdnuggets.com/beyond-human-boundaries-the-rise-of-superintelligence?utm_source=rss&utm_medium=rss&utm_campaign=beyond-human-boundaries-the-rise-of-superintelligence,"Wed, 29 Nov 2023 13:00:01 +0000",blogml,beyond human boundaries rise super ,"['beyond', 'human', 'boundaries', 'rise', 'super']","['beyond', 'human', 'boundaries', 'rise', 'super']"
11 magic methods every programmer know,want support behavior builtin functions method calls classes magic methods let lets uncover method behind magic,https://www.kdnuggets.com/11-python-magic-methods-every-programmer-should-know?utm_source=rss&utm_medium=rss&utm_campaign=11-python-magic-methods-every-programmer-should-know,"Tue, 28 Nov 2023 17:00:05 +0000",blogml,11 magic methods every programmer know want support behavior builtin functions method calls classes magic methods let lets uncover method behind magic,"['11', 'magic', 'methods', 'every', 'programmer', 'know', 'want', 'support', 'behavior', 'builtin', 'functions', 'method', 'calls', 'classes', 'magic', 'methods', 'let', 'lets', 'uncover', 'method', 'behind', 'magic']","['11', 'magic', 'methods', 'every', 'programmer', 'know']"
big saving lives real time iov analytics prevent accidents,posts talks needs taken care iov analysis shows difference near realtime analytic platform actual realtime analytic platform real example,https://www.kdnuggets.com/how-big-data-is-saving-lives-in-real-time-iov-data-analytics-helps-prevent-accidents?utm_source=rss&utm_medium=rss&utm_campaign=how-big-data-is-saving-lives-in-real-time-iov-data-analytics-helps-prevent-accidents,"Tue, 28 Nov 2023 15:00:12 +0000",blogml,big saving lives real time iov analytics prevent accidents posts talks needs taken care iov analysis shows difference near realtime analytic platform actual realtime analytic platform real example,"['big', 'saving', 'lives', 'real', 'time', 'iov', 'analytics', 'prevent', 'accidents', 'posts', 'talks', 'needs', 'taken', 'care', 'iov', 'analysis', 'shows', 'difference', 'near', 'realtime', 'analytic', 'platform', 'actual', 'realtime', 'analytic', 'platform', 'real', 'example']","['big', 'saving', 'lives', 'real', 'time', 'iov', 'analytics', 'prevent', 'accidents']"
mastering web scraping beautifulsoup,,https://www.kdnuggets.com/mastering-web-scraping-with-beautifulsoup?utm_source=rss&utm_medium=rss&utm_campaign=mastering-web-scraping-with-beautifulsoup,"Tue, 28 Nov 2023 13:00:05 +0000",blogml,mastering web scraping beautifulsoup ,"['mastering', 'web', 'scraping', 'beautifulsoup']","['mastering', 'web', 'scraping', 'beautifulsoup']"
csv complete analytical report chatgpt 5 simple steps,analysis timeconsuming activity chatgpt perform summary preprocessing visualization many others short time,https://www.kdnuggets.com/from-csv-to-complete-analytical-report-with-chatgpt-in-5-simple-steps?utm_source=rss&utm_medium=rss&utm_campaign=from-csv-to-complete-analytical-report-with-chatgpt-in-5-simple-steps,"Mon, 27 Nov 2023 17:00:32 +0000",blogml,csv complete analytical report chatgpt 5 simple steps analysis timeconsuming activity chatgpt perform summary preprocessing visualization many others short time,"['csv', 'complete', 'analytical', 'report', 'chatgpt', '5', 'simple', 'steps', 'analysis', 'timeconsuming', 'activity', 'chatgpt', 'perform', 'summary', 'preprocessing', 'visualization', 'many', 'others', 'short', 'time']","['csv', 'complete', 'analytical', 'report', 'chatgpt', '5', 'simple', 'steps']"
back basics week 4 advanced topics deployment,welcome back week 4 kdnuggets back basics series week dive advanced topics neural networks deployment,https://www.kdnuggets.com/back-to-basics-week-4-advanced-topics-and-deployment?utm_source=rss&utm_medium=rss&utm_campaign=back-to-basics-week-4-advanced-topics-and-deployment,"Mon, 27 Nov 2023 13:00:05 +0000",blogml,back basics week 4 advanced topics deployment welcome back week 4 kdnuggets back basics series week dive advanced topics neural networks deployment,"['back', 'basics', 'week', '4', 'advanced', 'topics', 'deployment', 'welcome', 'back', 'week', '4', 'kdnuggets', 'back', 'basics', 'series', 'week', 'dive', 'advanced', 'topics', 'neural', 'networks', 'deployment']","['back', 'basics', 'week', '4', 'advanced', 'topics', 'deployment']"
create stunning viz seconds chatgpt,,https://www.kdnuggets.com/create-stunning-data-viz-in-seconds-with-chatgpt?utm_source=rss&utm_medium=rss&utm_campaign=create-stunning-data-viz-in-seconds-with-chatgpt,"Fri, 24 Nov 2023 15:00:44 +0000",blogml,create stunning viz seconds chatgpt ,"['create', 'stunning', 'viz', 'seconds', 'chatgpt']","['create', 'stunning', 'viz', 'seconds', 'chatgpt']"
remote work pros cons,,https://www.kdnuggets.com/remote-work-in-data-science-pros-and-cons?utm_source=rss&utm_medium=rss&utm_campaign=remote-work-in-data-science-pros-and-cons,"Fri, 24 Nov 2023 13:00:06 +0000",blogml,remote work pros cons ,"['remote', 'work', 'pros', 'cons']","['remote', 'work', 'pros', 'cons']"
5 master,,https://www.kdnuggets.com/5-free-courses-to-master-machine-learning?utm_source=rss&utm_medium=rss&utm_campaign=5-free-courses-to-master-machine-learning,"Thu, 23 Nov 2023 13:00:51 +0000",blogml,5 master ,"['5', 'master']","['5', 'master']"
comprehensive list resources master large language,large language llms become integral part various applications article provides extensive list resources anyone interested dive llms,https://www.kdnuggets.com/a-comprehensive-list-of-resources-to-master-large-language-models?utm_source=rss&utm_medium=rss&utm_campaign=a-comprehensive-list-of-resources-to-master-large-language-models,"Wed, 22 Nov 2023 17:00:21 +0000",blogml,comprehensive list resources master large language large language llms become integral part various applications article provides extensive list resources anyone interested dive llms,"['comprehensive', 'list', 'resources', 'master', 'large', 'language', 'large', 'language', 'llms', 'become', 'integral', 'part', 'various', 'applications', 'article', 'provides', 'extensive', 'list', 'resources', 'anyone', 'interested', 'dive', 'llms']","['comprehensive', 'list', 'resources', 'master', 'large', 'language']"
soft skills every scientist needs,,https://www.kdnuggets.com/soft-skills-every-data-scientist-needs?utm_source=rss&utm_medium=rss&utm_campaign=soft-skills-every-data-scientist-needs,"Wed, 22 Nov 2023 15:00:17 +0000",blogml,soft skills every scientist needs ,"['soft', 'skills', 'every', 'scientist', 'needs']","['soft', 'skills', 'every', 'scientist', 'needs']"
ai replace humanity,,https://www.kdnuggets.com/will-ai-replace-humanity?utm_source=rss&utm_medium=rss&utm_campaign=will-ai-replace-humanity,"Wed, 22 Nov 2023 13:00:53 +0000",blogml,ai replace humanity ,"['ai', 'replace', 'humanity']","['ai', 'replace', 'humanity']"
kdnuggets news november 22 7 essential quality checks pandas 5 best vector bases must try 2024,week kdnuggets learn perform quality checks pandas detecting missing records outliers inconsistent entry top vector bases known versatility performance scalability consistency efficient algorithms storing indexing querying vector embeddings ai applications much much,https://www.kdnuggets.com/newsletter-n42-2023-11-22?utm_source=rss&utm_medium=rss&utm_campaign=kdnuggets-news-november-22-7-essential-data-quality-checks-with-pandas-the-5-best-vector-databases-you-must-try-in-2024,"Wed, 22 Nov 2023 11:00:20 +0000",blogml,kdnuggets news november 22 7 essential quality checks pandas 5 best vector bases must try 2024 week kdnuggets learn perform quality checks pandas detecting missing records outliers inconsistent entry top vector bases known versatility performance scalability consistency efficient algorithms storing indexing querying vector embeddings ai applications much much,"['kdnuggets', 'news', 'november', '22', '7', 'essential', 'quality', 'checks', 'pandas', '5', 'best', 'vector', 'bases', 'must', 'try', '2024', 'week', 'kdnuggets', 'learn', 'perform', 'quality', 'checks', 'pandas', 'detecting', 'missing', 'records', 'outliers', 'inconsistent', 'entry', 'top', 'vector', 'bases', 'known', 'versatility', 'performance', 'scalability', 'consistency', 'efficient', 'algorithms', 'storing', 'indexing', 'querying', 'vector', 'embeddings', 'ai', 'applications', 'much', 'much']","['kdnuggets', 'news', 'november', '22', '7', 'essential', 'quality', 'checks', 'pandas', '5', 'best', 'vector', 'bases', 'must', 'try', '2024']"
tackle computer problems fundamental modern algorithms,master algorithms including deep like lstms grus rnns generative ai 038 llms chatgpt packts 50 algorithms every programmer know,https://www.kdnuggets.com/2023/11/packt-tackle-computer-science-problems-fundamental-modern-algorithms-machine-learning?utm_source=rss&utm_medium=rss&utm_campaign=tackle-computer-science-problems-using-both-fundamental-and-modern-algorithms-in-machine-learning,"Tue, 21 Nov 2023 18:00:03 +0000",blogml,tackle computer problems fundamental modern algorithms master algorithms including deep like lstms grus rnns generative ai 038 llms chatgpt packts 50 algorithms every programmer know,"['tackle', 'computer', 'problems', 'fundamental', 'modern', 'algorithms', 'master', 'algorithms', 'including', 'deep', 'like', 'lstms', 'grus', 'rnns', 'generative', 'ai', '038', 'llms', 'chatgpt', 'packts', '50', 'algorithms', 'every', 'programmer', 'know']","['tackle', 'computer', 'problems', 'fundamental', 'modern', 'algorithms']"
make large language play nice software langchain,,https://www.kdnuggets.com/how-to-make-large-language-models-play-nice-with-your-software-using-langchain?utm_source=rss&utm_medium=rss&utm_campaign=how-to-make-large-language-models-play-nice-with-your-software-using-langchain,"Tue, 21 Nov 2023 17:00:50 +0000",blogml,make large language play nice software langchain ,"['make', 'large', 'language', 'play', 'nice', 'software', 'langchain']","['make', 'large', 'language', 'play', 'nice', 'software', 'langchain']"
job trends analytics part 2,,https://www.kdnuggets.com/job-trends-in-data-analytics-part-2?utm_source=rss&utm_medium=rss&utm_campaign=job-trends-in-data-analytics-part-2,"Tue, 21 Nov 2023 14:42:24 +0000",blogml,job trends analytics part 2 ,"['job', 'trends', 'analytics', 'part', '2']","['job', 'trends', 'analytics', 'part', '2']"
write efficient code tutorial beginners,,https://www.kdnuggets.com/how-to-write-efficient-python-code-a-tutorial-for-beginners?utm_source=rss&utm_medium=rss&utm_campaign=how-to-write-efficient-python-code-a-tutorial-for-beginners,"Tue, 21 Nov 2023 13:00:58 +0000",blogml,write efficient code tutorial beginners ,"['write', 'efficient', 'code', 'tutorial', 'beginners']","['write', 'efficient', 'code', 'tutorial', 'beginners']"
enhance coding style ruff,ruffs 700 builtin lint rules reimplemented rust speed provide comprehensive linting formatting enforce clean consistent code,https://www.kdnuggets.com/enhance-your-python-coding-style-with-ruff?utm_source=rss&utm_medium=rss&utm_campaign=enhance-your-python-coding-style-with-ruff,"Mon, 20 Nov 2023 17:00:52 +0000",blogml,enhance coding style ruff ruffs 700 builtin lint rules reimplemented rust speed provide comprehensive linting formatting enforce clean consistent code,"['enhance', 'coding', 'style', 'ruff', 'ruffs', '700', 'builtin', 'lint', 'rules', 'reimplemented', 'rust', 'speed', 'provide', 'comprehensive', 'linting', 'formatting', 'enforce', 'clean', 'consistent', 'code']","['enhance', 'coding', 'style', 'ruff']"
overuse list comprehensions,,https://www.kdnuggets.com/why-you-should-not-overuse-list-comprehensions-in-python?utm_source=rss&utm_medium=rss&utm_campaign=your-kdnuggets-post-why-you-should-not-overuse-list-comprehensions-in-python,"Mon, 20 Nov 2023 15:00:30 +0000",blogml,overuse list comprehensions ,"['overuse', 'list', 'comprehensions']","['overuse', 'list', 'comprehensions']"
back basics week 3 introduction,,https://www.kdnuggets.com/back-to-basics-week-3-introduction-to-machine-learning?utm_source=rss&utm_medium=rss&utm_campaign=back-to-basics-week-3-introduction-to-machine-learning,"Mon, 20 Nov 2023 13:00:13 +0000",blogml,back basics week 3 introduction ,"['back', 'basics', 'week', '3', 'introduction']","['back', 'basics', 'week', '3', 'introduction']"
5 master generative ai,,https://www.kdnuggets.com/5-free-courses-to-master-generative-ai?utm_source=rss&utm_medium=rss&utm_campaign=5-free-courses-to-master-generative-ai,"Mon, 20 Nov 2023 11:00:39 +0000",blogml,5 master generative ai ,"['5', 'master', 'generative', 'ai']","['5', 'master', 'generative', 'ai']"
5 best vector bases must try 2024,top vector bases known versatility performance scalability consistency efficient algorithms storing indexing querying vector embeddings ai applications,https://www.kdnuggets.com/the-5-best-vector-databases-you-must-try-in-2024?utm_source=rss&utm_medium=rss&utm_campaign=the-5-best-vector-databases-you-must-try-in-2024,"Fri, 17 Nov 2023 15:00:41 +0000",blogml,5 best vector bases must try 2024 top vector bases known versatility performance scalability consistency efficient algorithms storing indexing querying vector embeddings ai applications,"['5', 'best', 'vector', 'bases', 'must', 'try', '2024', 'top', 'vector', 'bases', 'known', 'versatility', 'performance', 'scalability', 'consistency', 'efficient', 'algorithms', 'storing', 'indexing', 'querying', 'vector', 'embeddings', 'ai', 'applications']","['5', 'best', 'vector', 'bases', 'must', 'try', '2024']"
microsoft engineers guide ai innovation leadership,dive insights ai innovation microsofts senior software engineer manas joshi journey technology triumph teachings next generation,https://www.kdnuggets.com/a-microsoft-engineer-guide-to-ai-innovation-and-leadership?utm_source=rss&utm_medium=rss&utm_campaign=a-microsoft-engineers-guide-to-ai-innovation-and-leadership,"Fri, 17 Nov 2023 13:00:22 +0000",blogml,microsoft engineers guide ai innovation leadership dive insights ai innovation microsofts senior software engineer manas joshi journey technology triumph teachings next generation,"['microsoft', 'engineers', 'guide', 'ai', 'innovation', 'leadership', 'dive', 'insights', 'ai', 'innovation', 'microsofts', 'senior', 'software', 'engineer', 'manas', 'joshi', 'journey', 'technology', 'triumph', 'teachings', 'next', 'generation']","['microsoft', 'engineers', 'guide', 'ai', 'innovation', 'leadership']"
master 3rd best online program,,https://www.kdnuggets.com/2023/11/bay-path-master-data-science-3rd-best-online-program?utm_source=rss&utm_medium=rss&utm_campaign=master-data-science-with-the-3rd-best-online-program,"Thu, 16 Nov 2023 23:49:10 +0000",blogml,master 3rd best online program ,"['master', '3rd', 'best', 'online', 'program']","['master', '3rd', 'best', 'online', 'program']"
6 problems llms langchain trying assess,,https://www.kdnuggets.com/6-problems-of-llms-that-langchain-is-trying-to-assess?utm_source=rss&utm_medium=rss&utm_campaign=6-problems-of-llms-that-langchain-is-trying-to-assess,"Thu, 16 Nov 2023 17:00:10 +0000",blogml,6 problems llms langchain trying assess ,"['6', 'problems', 'llms', 'langchain', 'trying', 'assess']","['6', 'problems', 'llms', 'langchain', 'trying', 'assess']"
optimizing analytics integrating github copilot bricks,integrating aipowered pair programming tools analytics bricks optimizes streamlines development process ing developer time innovation,https://www.kdnuggets.com/optimizing-data-analytics-integrating-github-copilot-in-databricks?utm_source=rss&utm_medium=rss&utm_campaign=optimizing-data-analytics-integrating-github-copilot-in-databricks,"Thu, 16 Nov 2023 15:00:01 +0000",blogml,optimizing analytics integrating github copilot bricks integrating aipowered pair programming tools analytics bricks optimizes streamlines development process ing developer time innovation,"['optimizing', 'analytics', 'integrating', 'github', 'copilot', 'bricks', 'integrating', 'aipowered', 'pair', 'programming', 'tools', 'analytics', 'bricks', 'optimizes', 'streamlines', 'development', 'process', 'ing', 'developer', 'time', 'innovation']","['optimizing', 'analytics', 'integrating', 'github', 'copilot', 'bricks']"
7 essential quality checks pandas,,https://www.kdnuggets.com/7-essential-data-quality-checks-with-pandas?utm_source=rss&utm_medium=rss&utm_campaign=7-essential-data-quality-checks-with-pandas,"Thu, 16 Nov 2023 13:00:56 +0000",blogml,7 essential quality checks pandas ,"['7', 'essential', 'quality', 'checks', 'pandas']","['7', 'essential', 'quality', 'checks', 'pandas']"
introduction streamingllm llms infinitelength inputs,,https://www.kdnuggets.com/introduction-to-streaming-llm-llms-for-infinite-length-inputs?utm_source=rss&utm_medium=rss&utm_campaign=introduction-to-streaming-llm-llms-for-infinite-length-inputs,"Wed, 15 Nov 2023 17:00:24 +0000",blogml,introduction streamingllm llms infinitelength inputs ,"['introduction', 'streamingllm', 'llms', 'infinitelength', 'inputs']","['introduction', 'streamingllm', 'llms', 'infinitelength', 'inputs']"
better way evaluate llms,article introduces new approach evaluation llms leverages human insight compare llm responses real user prompts categorized nlp offering promising solution advancing llm evaluation standards,https://www.kdnuggets.com/a-better-way-to-evaluate-llms?utm_source=rss&utm_medium=rss&utm_campaign=a-better-way-to-evaluate-llms,"Wed, 15 Nov 2023 15:00:53 +0000",blogml,better way evaluate llms article introduces new approach evaluation llms leverages human insight compare llm responses real user prompts categorized nlp offering promising solution advancing llm evaluation standards,"['better', 'way', 'evaluate', 'llms', 'article', 'introduces', 'new', 'approach', 'evaluation', 'llms', 'leverages', 'human', 'insight', 'compare', 'llm', 'responses', 'real', 'user', 'prompts', 'categorized', 'nlp', 'offering', 'promising', 'solution', 'advancing', 'llm', 'evaluation', 'standards']","['better', 'way', 'evaluate', 'llms']"
make gpts chatgpts gpts,,https://www.kdnuggets.com/make-your-own-gpts-with-chatgpts-gpts?utm_source=rss&utm_medium=rss&utm_campaign=make-your-own-gpts-with-chatgpts-gpts,"Wed, 15 Nov 2023 13:04:54 +0000",blogml,make gpts chatgpts gpts ,"['make', 'gpts', 'chatgpts', 'gpts']","['make', 'gpts', 'chatgpts', 'gpts']"
rise fall prompt engineering fad future,,https://www.kdnuggets.com/the-rise-and-fall-of-prompt-engineering-fad-or-future?utm_source=rss&utm_medium=rss&utm_campaign=the-rise-and-fall-of-prompt-engineering-fad-or-future,"Wed, 15 Nov 2023 13:00:17 +0000",blogml,rise fall prompt engineering fad future ,"['rise', 'fall', 'prompt', 'engineering', 'fad', 'future']","['rise', 'fall', 'prompt', 'engineering', 'fad', 'future']"
kdnuggets news november 15 10 essential pandas functions 5 master,week kdnuggets check ten pandas functions important well handy every scientist start upskilling today learn programming analysis much much,https://www.kdnuggets.com/newsletter-n41-2023-11-15?utm_source=rss&utm_medium=rss&utm_campaign=kdnuggets-news-november-15-10-essential-pandas-functions-5-free-courses-to-master-data-science,"Wed, 15 Nov 2023 10:45:50 +0000",blogml,kdnuggets news november 15 10 essential pandas functions 5 master week kdnuggets check ten pandas functions important well handy every scientist start upskilling today learn programming analysis much much,"['kdnuggets', 'news', 'november', '15', '10', 'essential', 'pandas', 'functions', '5', 'master', 'week', 'kdnuggets', 'check', 'ten', 'pandas', 'functions', 'important', 'well', 'handy', 'every', 'scientist', 'start', 'upskilling', 'today', 'learn', 'programming', 'analysis', 'much', 'much']","['kdnuggets', 'news', 'november', '15', '10', 'essential', 'pandas', 'functions', '5', 'master']"
