Title,Body,Link,Date,Type,Combined_Text,PText,PTitle
honduras arrest warrant issued murder activist berta cceres,,https://www.theguardian.com/world/2023/dec/02/honduras-arrest-warrant-issued-over-of-activist-berta-caceres,"Sat, 02 Dec 2023 14:35:43 GMT",news,honduras arrest warrant issued murder activist berta cceres ,"['honduras', 'arrest', 'warrant', 'issued', 'murder', 'activist', 'berta', 'cceres']","['honduras', 'arrest', 'warrant', 'issued', 'murder', 'activist', 'berta', 'cceres']"
lulas bid style climate leader cop28 undermined opec move,,https://www.theguardian.com/environment/2023/dec/02/lula-climate-leader-cop28-brazil-undermined-by-opec-move,"Sat, 02 Dec 2023 12:00:45 GMT",news,lulas bid style climate leader cop28 undermined opec move ,"['lulas', 'bid', 'style', 'climate', 'leader', 'cop28', 'undermined', 'opec', 'move']","['lulas', 'bid', 'style', 'climate', 'leader', 'cop28', 'undermined', 'opec', 'move']"
nicaraguas miss universe emerges symbol defiance ortega regime,nervous government cracked celebrations sheynnis palacios country repression absolutewhen sheynnis palacios recently voted miss universe came bolt good nicaragua joyous crowds took streets managua first time since mass protests 2018 put lethal forcethe nicaraguan regime paranoid hint dissidence initially congratulated palacios since cracked celebrations least palacios took part 2018 demonstrations opponents regime taken hrefhttpswwweluniversalcommxmundolan,https://www.theguardian.com/world/2023/dec/02/nicaragua-miss-universe-sheynnis-palacios-ortega,"Sat, 02 Dec 2023 12:00:45 GMT",news,nicaraguas miss universe emerges symbol defiance ortega regime nervous government cracked celebrations sheynnis palacios country repression absolutewhen sheynnis palacios recently voted miss universe came bolt good nicaragua joyous crowds took streets managua first time since mass protests 2018 put lethal forcethe nicaraguan regime paranoid hint dissidence initially congratulated palacios since cracked celebrations least palacios took part 2018 demonstrations opponents regime taken hrefhttpswwweluniversalcommxmundolan,"['nicaraguas', 'miss', 'universe', 'emerges', 'symbol', 'defiance', 'ortega', 'regime', 'nervous', 'government', 'cracked', 'celebrations', 'sheynnis', 'palacios', 'country', 'repression', 'absolutewhen', 'sheynnis', 'palacios', 'recently', 'voted', 'miss', 'universe', 'came', 'bolt', 'good', 'nicaragua', 'joyous', 'crowds', 'took', 'streets', 'managua', 'first', 'time', 'since', 'mass', 'protests', '2018', 'put', 'lethal', 'forcethe', 'nicaraguan', 'regime', 'paranoid', 'hint', 'dissidence', 'initially', 'congratulated', 'palacios', 'since', 'cracked', 'celebrations', 'least', 'palacios', 'took', 'part', '2018', 'demonstrations', 'opponents', 'regime', 'taken', 'hrefhttpswwweluniversalcommxmundolan']","['nicaraguas', 'miss', 'universe', 'emerges', 'symbol', 'defiance', 'ortega', 'regime']"
colombia joins international alliance calling treaty end use fossil fuels,colombian president gustavo petro wants treaty lay plan end era coal oil gascop28 live latest updatescolombia formally joined alliance nations calling fossil fuel nonproliferation treaty prevent omnicide planet earth countrys president announced cop28at climate summit dubai gustavo petro said country would join group nations calling body manage global transition away primary driver global heating akin previous treaties reduce nuclear weapon arsenals landminesa hrefhttpswwwtheguardiancomguardianliveevents2023nov21c,https://www.theguardian.com/environment/2023/dec/02/colombia-joins-international-alliance-calling-for-treaty-to-end-use-of-fossil-fuels,"Sat, 02 Dec 2023 11:33:33 GMT",news,colombia joins international alliance calling treaty end use fossil fuels colombian president gustavo petro wants treaty lay plan end era coal oil gascop28 live latest updatescolombia formally joined alliance nations calling fossil fuel nonproliferation treaty prevent omnicide planet earth countrys president announced cop28at climate summit dubai gustavo petro said country would join group nations calling body manage global transition away primary driver global heating akin previous treaties reduce nuclear weapon arsenals landminesa hrefhttpswwwtheguardiancomguardianliveevents2023nov21c,"['colombia', 'joins', 'international', 'alliance', 'calling', 'treaty', 'end', 'use', 'fossil', 'fuels', 'colombian', 'president', 'gustavo', 'petro', 'wants', 'treaty', 'lay', 'plan', 'end', 'era', 'coal', 'oil', 'gascop28', 'live', 'latest', 'updatescolombia', 'formally', 'joined', 'alliance', 'nations', 'calling', 'fossil', 'fuel', 'nonproliferation', 'treaty', 'prevent', 'omnicide', 'planet', 'earth', 'countrys', 'president', 'announced', 'cop28at', 'climate', 'summit', 'dubai', 'gustavo', 'petro', 'said', 'country', 'would', 'join', 'group', 'nations', 'calling', 'body', 'manage', 'global', 'transition', 'away', 'primary', 'driver', 'global', 'heating', 'akin', 'previous', 'treaties', 'reduce', 'nuclear', 'weapon', 'arsenals', 'landminesa', 'hrefhttpswwwtheguardiancomguardianliveevents2023nov21c']","['colombia', 'joins', 'international', 'alliance', 'calling', 'treaty', 'end', 'use', 'fossil', 'fuels']"
despotic maduro accused risking venezuelaguyana conflict oilrich region,,https://www.theguardian.com/world/2023/dec/01/venezuela-oil-guyana-essequibo-vote-nicolas-maduro,"Fri, 01 Dec 2023 12:00:15 GMT",news,despotic maduro accused risking venezuelaguyana conflict oilrich region ,"['despotic', 'maduro', 'accused', 'risking', 'venezuelaguyana', 'conflict', 'oilrich', 'region']","['despotic', 'maduro', 'accused', 'risking', 'venezuelaguyana', 'conflict', 'oilrich', 'region']"
latin america remembers kissingers profound moral wretchedness,,https://www.theguardian.com/us-news/2023/nov/30/henry-kissinger-chile-argentina-south-america,"Thu, 30 Nov 2023 20:16:09 GMT",news,latin america remembers kissingers profound moral wretchedness ,"['latin', 'america', 'remembers', 'kissingers', 'profound', 'moral', 'wretchedness']","['latin', 'america', 'remembers', 'kissingers', 'profound', 'moral', 'wretchedness']"
tsunami warning philippines hit 75 magnitude earthquake,,https://www.theguardian.com/world/2023/dec/02/philippines-hit-by-earthquake-tsunami-say-experts,"Sat, 02 Dec 2023 19:13:19 GMT",news,tsunami warning philippines hit 75 magnitude earthquake ,"['tsunami', 'warning', 'philippines', 'hit', '75', 'magnitude', 'earthquake']","['tsunami', 'warning', 'philippines', 'hit', '75', 'magnitude', 'earthquake']"
south korea launches first military spy satellite intensifying space race pyongyang,,https://www.theguardian.com/world/2023/dec/02/south-korea-launches-first-military-spy-satellite-intensifying-space-race-with-pyongyang,"Sat, 02 Dec 2023 03:37:06 GMT",news,south korea launches first military spy satellite intensifying space race pyongyang ,"['south', 'korea', 'launches', 'first', 'military', 'spy', 'satellite', 'intensifying', 'space', 'race', 'pyongyang']","['south', 'korea', 'launches', 'first', 'military', 'spy', 'satellite', 'intensifying', 'space', 'race', 'pyongyang']"
worlds biggest experimental nuclear fusion reactor launched japan,,https://www.theguardian.com/world/2023/dec/01/worlds-biggest-experimental-nuclear-fusion-reactor-launched-in-japan,"Fri, 01 Dec 2023 13:35:31 GMT",news,worlds biggest experimental nuclear fusion reactor launched japan ,"['worlds', 'biggest', 'experimental', 'nuclear', 'fusion', 'reactor', 'launched', 'japan']","['worlds', 'biggest', 'experimental', 'nuclear', 'fusion', 'reactor', 'launched', 'japan']"
exit edinburgh zoo may signal end era chinas panda diplomacy,,https://www.theguardian.com/world/2023/dec/01/panda-diplomacy-exit-from-edinburgh-zoo-may-signal-end-of-era,"Fri, 01 Dec 2023 11:16:49 GMT",news,exit edinburgh zoo may signal end era chinas panda diplomacy ,"['exit', 'edinburgh', 'zoo', 'may', 'signal', 'end', 'era', 'chinas', 'panda', 'diplomacy']","['exit', 'edinburgh', 'zoo', 'may', 'signal', 'end', 'era', 'chinas', 'panda', 'diplomacy']"
fears raised hong kong journalist fails return china trip,,https://www.theguardian.com/world/2023/dec/01/minnie-chan-south-china-morning-post-journalist-missing-xiangshan-forum,"Fri, 01 Dec 2023 10:38:43 GMT",news,fears raised hong kong journalist fails return china trip ,"['fears', 'raised', 'hong', 'kong', 'journalist', 'fails', 'return', 'china', 'trip']","['fears', 'raised', 'hong', 'kong', 'journalist', 'fails', 'return', 'china', 'trip']"
pharrell williams takes louis vuitton hong kong second mens show,creative director targets east asias luxury market preppy streetwear given tropical twistfor first show mens creative director louis vuitton june pharrell williams closed pont neuf paris counted megacelebrities including beyonc jayz rihanna aap rocky guestshis second effort took place hong kong focused local stars front row actors zhu yilong chow yunfat joined three members cantopop band mirror rapper tyson yoshi also take celestial stars light show end rendering louis vuitton monogram twinkling lights,https://www.theguardian.com/fashion/2023/nov/30/pharrell-williams-louis-vuitton-hong-kong-second-mens-show,"Thu, 30 Nov 2023 15:01:18 GMT",news,pharrell williams takes louis vuitton hong kong second mens show creative director targets east asias luxury market preppy streetwear given tropical twistfor first show mens creative director louis vuitton june pharrell williams closed pont neuf paris counted megacelebrities including beyonc jayz rihanna aap rocky guestshis second effort took place hong kong focused local stars front row actors zhu yilong chow yunfat joined three members cantopop band mirror rapper tyson yoshi also take celestial stars light show end rendering louis vuitton monogram twinkling lights,"['pharrell', 'williams', 'takes', 'louis', 'vuitton', 'hong', 'kong', 'second', 'mens', 'show', 'creative', 'director', 'targets', 'east', 'asias', 'luxury', 'market', 'preppy', 'streetwear', 'given', 'tropical', 'twistfor', 'first', 'show', 'mens', 'creative', 'director', 'louis', 'vuitton', 'june', 'pharrell', 'williams', 'closed', 'pont', 'neuf', 'paris', 'counted', 'megacelebrities', 'including', 'beyonc', 'jayz', 'rihanna', 'aap', 'rocky', 'guestshis', 'second', 'effort', 'took', 'place', 'hong', 'kong', 'focused', 'local', 'stars', 'front', 'row', 'actors', 'zhu', 'yilong', 'chow', 'yunfat', 'joined', 'three', 'members', 'cantopop', 'band', 'mirror', 'rapper', 'tyson', 'yoshi', 'also', 'take', 'celestial', 'stars', 'light', 'show', 'end', 'rendering', 'louis', 'vuitton', 'monogram', 'twinkling', 'lights']","['pharrell', 'williams', 'takes', 'louis', 'vuitton', 'hong', 'kong', 'second', 'mens', 'show']"
vacant property taxes levies caps table nsw labor reviews airbnbs shortterm rentals,exclusive minns government place every aspect housing microscope confronts rental crisisget morning afternoon emails free app daily podcastvacant property taxes levies annual caps considered south wales government reviews regulation shortterm rentals including ai,https://www.theguardian.com/australia-news/2023/dec/03/vacant-property-taxes-levies-and-caps-on-the-table-as-nsw-labor-reviews-airbnbs-and-short-term-rentals,"Sat, 02 Dec 2023 19:00:53 GMT",news,vacant property taxes levies caps table nsw labor reviews airbnbs shortterm rentals exclusive minns government place every aspect housing microscope confronts rental crisisget morning afternoon emails free app daily podcastvacant property taxes levies annual caps considered south wales government reviews regulation shortterm rentals including ai,"['vacant', 'property', 'taxes', 'levies', 'caps', 'table', 'nsw', 'labor', 'reviews', 'airbnbs', 'shortterm', 'rentals', 'exclusive', 'minns', 'government', 'place', 'every', 'aspect', 'housing', 'microscope', 'confronts', 'rental', 'crisisget', 'morning', 'afternoon', 'emails', 'free', 'app', 'daily', 'podcastvacant', 'property', 'taxes', 'levies', 'annual', 'caps', 'considered', 'south', 'wales', 'government', 'reviews', 'regulation', 'shortterm', 'rentals', 'including', 'ai']","['vacant', 'property', 'taxes', 'levies', 'caps', 'table', 'nsw', 'labor', 'reviews', 'airbnbs', 'shortterm', 'rentals']"
coles woolworths face senate scrutiny amid claims profiteering,greens win support inquiry effect market concentration food prices pattern major chains pricing strategiesget morning afternoon emails free app daily podcastaustralias big supermarkets face fresh scrutiny senate inquiry investigate market power pricing decisions amid concerns profiteered inflationary period marked fastrising food co,https://www.theguardian.com/australia-news/2023/dec/03/coles-and-woolworths-to-face-senate-scrutiny-amid-claims-of-profiteering,"Sat, 02 Dec 2023 14:00:47 GMT",news,coles woolworths face senate scrutiny amid claims profiteering greens win support inquiry effect market concentration food prices pattern major chains pricing strategiesget morning afternoon emails free app daily podcastaustralias big supermarkets face fresh scrutiny senate inquiry investigate market power pricing decisions amid concerns profiteered inflationary period marked fastrising food co,"['coles', 'woolworths', 'face', 'senate', 'scrutiny', 'amid', 'claims', 'profiteering', 'greens', 'win', 'support', 'inquiry', 'effect', 'market', 'concentration', 'food', 'prices', 'pattern', 'major', 'chains', 'pricing', 'strategiesget', 'morning', 'afternoon', 'emails', 'free', 'app', 'daily', 'podcastaustralias', 'big', 'supermarkets', 'face', 'fresh', 'scrutiny', 'senate', 'inquiry', 'investigate', 'market', 'power', 'pricing', 'decisions', 'amid', 'concerns', 'profiteered', 'inflationary', 'period', 'marked', 'fastrising', 'food', 'co']","['coles', 'woolworths', 'face', 'senate', 'scrutiny', 'amid', 'claims', 'profiteering']"
australia ai used help track chinese submarines aukus plan,defence minister richard marles counterparts uk us technologies deployed militariesget morning afternoon emails free app daily podcastartificial intelligence drones deep space radar among technologies used australia aukus allies counter chinas aggression pacificaustralias defence minister richard marles met counterparts united states united kingdom lloyd j austin grant shapps california saturday announce,https://www.theguardian.com/world/2023/dec/02/australia-says-ai-will-be-used-to-help-track-chinese-submarines-under-new-aukus-plan,"Sat, 02 Dec 2023 07:00:59 GMT",news,australia ai used help track chinese submarines aukus plan defence minister richard marles counterparts uk us technologies deployed militariesget morning afternoon emails free app daily podcastartificial intelligence drones deep space radar among technologies used australia aukus allies counter chinas aggression pacificaustralias defence minister richard marles met counterparts united states united kingdom lloyd j austin grant shapps california saturday announce,"['australia', 'ai', 'used', 'help', 'track', 'chinese', 'submarines', 'aukus', 'plan', 'defence', 'minister', 'richard', 'marles', 'counterparts', 'uk', 'us', 'technologies', 'deployed', 'militariesget', 'morning', 'afternoon', 'emails', 'free', 'app', 'daily', 'podcastartificial', 'intelligence', 'drones', 'deep', 'space', 'radar', 'among', 'technologies', 'used', 'australia', 'aukus', 'allies', 'counter', 'chinas', 'aggression', 'pacificaustralias', 'defence', 'minister', 'richard', 'marles', 'met', 'counterparts', 'united', 'states', 'united', 'kingdom', 'lloyd', 'j', 'austin', 'grant', 'shapps', 'california', 'saturday', 'announce']","['australia', 'ai', 'used', 'help', 'track', 'chinese', 'submarines', 'aukus', 'plan']"
young green sea turtles tracked travelling deep sydney harbour living near humans,taronga wildlife hospital tracked three turtles rescued one swimming far longuevilleget morning afternoon emails free app daily podcastendangered green sea turtles spend much young lives close proximity people including travelling deep within sydney harbour research suggestssatellite tracking shows turtles frequenting busy waterways including harbour parramatta river around wollongong harbour brisbane waters near gosford hawkesbury river far cottage point,https://www.theguardian.com/australia-news/2023/dec/02/young-green-sea-turtles-tracked-travelling-deep-into-sydney-harbour-and-living-near-humans,"Sat, 02 Dec 2023 02:53:36 GMT",news,young green sea turtles tracked travelling deep sydney harbour living near humans taronga wildlife hospital tracked three turtles rescued one swimming far longuevilleget morning afternoon emails free app daily podcastendangered green sea turtles spend much young lives close proximity people including travelling deep within sydney harbour research suggestssatellite tracking shows turtles frequenting busy waterways including harbour parramatta river around wollongong harbour brisbane waters near gosford hawkesbury river far cottage point,"['young', 'green', 'sea', 'turtles', 'tracked', 'travelling', 'deep', 'sydney', 'harbour', 'living', 'near', 'humans', 'taronga', 'wildlife', 'hospital', 'tracked', 'three', 'turtles', 'rescued', 'one', 'swimming', 'far', 'longuevilleget', 'morning', 'afternoon', 'emails', 'free', 'app', 'daily', 'podcastendangered', 'green', 'sea', 'turtles', 'spend', 'much', 'young', 'lives', 'close', 'proximity', 'people', 'including', 'travelling', 'deep', 'within', 'sydney', 'harbour', 'research', 'suggestssatellite', 'tracking', 'shows', 'turtles', 'frequenting', 'busy', 'waterways', 'including', 'harbour', 'parramatta', 'river', 'around', 'wollongong', 'harbour', 'brisbane', 'waters', 'near', 'gosford', 'hawkesbury', 'river', 'far', 'cottage', 'point']","['young', 'green', 'sea', 'turtles', 'tracked', 'travelling', 'deep', 'sydney', 'harbour', 'living', 'near', 'humans']"
tsunami traffic chaos sydney motorway prompting calls royal commission,top expert bungled opening rozelle interchange bad enough warrant formal inquiry 20bn westconnex projectsydneysiders promised nirvana would delivered 20bn westconnex motorway rightly bemused bitter seem ended placethe bungled opening final stage westconnex rozelle interchange bad enough veteran transport experts michelle zeibots university tech,https://www.theguardian.com/australia-news/2023/dec/02/a-tsunami-of-traffic-chaos-the-new-sydney-motorway-prompting-calls-for-a-royal-commission,"Fri, 01 Dec 2023 23:00:28 GMT",news,tsunami traffic chaos sydney motorway prompting calls royal commission top expert bungled opening rozelle interchange bad enough warrant formal inquiry 20bn westconnex projectsydneysiders promised nirvana would delivered 20bn westconnex motorway rightly bemused bitter seem ended placethe bungled opening final stage westconnex rozelle interchange bad enough veteran transport experts michelle zeibots university tech,"['tsunami', 'traffic', 'chaos', 'sydney', 'motorway', 'prompting', 'calls', 'royal', 'commission', 'top', 'expert', 'bungled', 'opening', 'rozelle', 'interchange', 'bad', 'enough', 'warrant', 'formal', 'inquiry', '20bn', 'westconnex', 'projectsydneysiders', 'promised', 'nirvana', 'would', 'delivered', '20bn', 'westconnex', 'motorway', 'rightly', 'bemused', 'bitter', 'seem', 'ended', 'placethe', 'bungled', 'opening', 'final', 'stage', 'westconnex', 'rozelle', 'interchange', 'bad', 'enough', 'veteran', 'transport', 'experts', 'michelle', 'zeibots', 'university', 'tech']","['tsunami', 'traffic', 'chaos', 'sydney', 'motorway', 'prompting', 'calls', 'royal', 'commission']"
australia eu talks day war gaza unite twostate solution,european commission vicepresident must role hamas postconflict horizon visit australiaget morning afternoon emails free app daily podcastaustralia european union talks day war gaza united calls revive twostate solution senior official saidbut european commission vicepresident margaritis schinas added hamas forfeited right part political settlementa hrefhttpswwwtheguardian,https://www.theguardian.com/world/2023/dec/02/australia-eu-talks-day-after-israel-hamas-war-gaza-palestine-two-state-solution,"Fri, 01 Dec 2023 14:00:20 GMT",news,australia eu talks day war gaza unite twostate solution european commission vicepresident must role hamas postconflict horizon visit australiaget morning afternoon emails free app daily podcastaustralia european union talks day war gaza united calls revive twostate solution senior official saidbut european commission vicepresident margaritis schinas added hamas forfeited right part political settlementa hrefhttpswwwtheguardian,"['australia', 'eu', 'talks', 'day', 'war', 'gaza', 'unite', 'twostate', 'solution', 'european', 'commission', 'vicepresident', 'must', 'role', 'hamas', 'postconflict', 'horizon', 'visit', 'australiaget', 'morning', 'afternoon', 'emails', 'free', 'app', 'daily', 'podcastaustralia', 'european', 'union', 'talks', 'day', 'war', 'gaza', 'united', 'calls', 'revive', 'twostate', 'solution', 'senior', 'official', 'saidbut', 'european', 'commission', 'vicepresident', 'margaritis', 'schinas', 'added', 'hamas', 'forfeited', 'right', 'part', 'political', 'settlementa', 'hrefhttpswwwtheguardian']","['australia', 'eu', 'talks', 'day', 'war', 'gaza', 'unite', 'twostate', 'solution']"
leaning tower bologna saved city announces 4m repair project,,https://www.theguardian.com/world/2023/dec/02/leaning-tower-in-bologna-to-be-saved-as-city-announces-4m-repair-project,"Sat, 02 Dec 2023 15:18:56 GMT",news,leaning tower bologna saved city announces 4m repair project ,"['leaning', 'tower', 'bologna', 'saved', 'city', 'announces', '4m', 'repair', 'project']","['leaning', 'tower', 'bologna', 'saved', 'city', 'announces', '4m', 'repair', 'project']"
heavy snow brings chaos southern germany munich suspends flights,,https://www.theguardian.com/world/2023/dec/02/snow-chaos-southern-germany-munich-airport-suspends-flights,"Sat, 02 Dec 2023 14:01:36 GMT",news,heavy snow brings chaos southern germany munich suspends flights ,"['heavy', 'snow', 'brings', 'chaos', 'southern', 'germany', 'munich', 'suspends', 'flights']","['heavy', 'snow', 'brings', 'chaos', 'southern', 'germany', 'munich', 'suspends', 'flights']"
russiaukraine war kremlin trying quell dissent soldiers wives money online attacks uk happened,live blog closed read ukraine war coverage hereassociated press provided little detail russian foreign minister sergei lavrovs earlier comments said moscow saw signs kyiv ready move towards political resolutionspeaking organization security cooperation europe conference north macedonia lavrov also said russia prepared review goals ukrainerussian authorities attempting quell dissent wives soldiers deployed ukraine uks ministry defence said mod said daily intelligence bri,https://www.theguardian.com/world/live/2023/dec/02/russia-ukraine-war-putin-zelenskiy-latest-news,"Sat, 02 Dec 2023 13:31:10 GMT",news,russiaukraine war kremlin trying quell dissent soldiers wives money online attacks uk happened live blog closed read ukraine war coverage hereassociated press provided little detail russian foreign minister sergei lavrovs earlier comments said moscow saw signs kyiv ready move towards political resolutionspeaking organization security cooperation europe conference north macedonia lavrov also said russia prepared review goals ukrainerussian authorities attempting quell dissent wives soldiers deployed ukraine uks ministry defence said mod said daily intelligence bri,"['russiaukraine', 'war', 'kremlin', 'trying', 'quell', 'dissent', 'soldiers', 'wives', 'money', 'online', 'attacks', 'uk', 'happened', 'live', 'blog', 'closed', 'read', 'ukraine', 'war', 'coverage', 'hereassociated', 'press', 'provided', 'little', 'detail', 'russian', 'foreign', 'minister', 'sergei', 'lavrovs', 'earlier', 'comments', 'said', 'moscow', 'saw', 'signs', 'kyiv', 'ready', 'move', 'towards', 'political', 'resolutionspeaking', 'organization', 'security', 'cooperation', 'europe', 'conference', 'north', 'macedonia', 'lavrov', 'also', 'said', 'russia', 'prepared', 'review', 'goals', 'ukrainerussian', 'authorities', 'attempting', 'quell', 'dissent', 'wives', 'soldiers', 'deployed', 'ukraine', 'uks', 'ministry', 'defence', 'said', 'mod', 'said', 'daily', 'intelligence', 'bri']","['russiaukraine', 'war', 'kremlin', 'trying', 'quell', 'dissent', 'soldiers', 'wives', 'money', 'online', 'attacks', 'uk', 'happened']"
